id,short_context,full_context,emo_term,affect_score,affect_score_a,affect_score_b
fvznpl,"<strong>But this mistake I did is one I've made before, and I feel <span style=""background-color:#2dfe5f"">appalled</span>  by the fact that I did it again, furthermore with a girl that was that attractive.</strong><br>","<em> How can I deal with regrets when it seems to me that nothing was out of my control and overcome the unnecessary reasons for my pain </em><br><br>Hey everyone.Some of my dark feelings are expressed below without filters.<br><br>To make it short, I'm very disappointed and angry at myself these days because I messed up with an incredible girl that I was attracted to.She's gorgeous and interesting, and I'm feeling like I'll have a hard time meeting a girl like her.<br><br>I invited her to have a coffee with me 2 months ago, to which she agreed, but then I proceeded to ruin everything by letting my fears take control over me and not talking to her anymore or taking any action that would lead to a relationship with her.Despite this, she came back to me recently through texting, and I feel like I ruined it again by projecting onto her the insecurities I felt regarding my past behaviour (basically, I didn't understand why she would come back to me when ""obviously"" I acted like a timid and fearful child towards her, and thus sent her weird texts that showed how insecure I had become in respect to her).<br><br>Because of that, I've barely been living for the last week.I haven't slept last night and just woke up from a nap (it's 4pm where I live), have lacked the willpower to study or exercise.The lack of control over my emotions led me to start reading Marcus Aurelius again to find some insight about how I should deal with this.<br><br>It seems, however, that stoicism would only help me in so far as the things I regret are not fully in my control.I know it seems from what I've written that my failure wasn't fully in my control, as my insecurities, immaturity and fears are still flaws that I must overcome.<strong>But this mistake I did is one I've made before, and I feel <span style=""background-color:#2dfe5f"">appalled</span>  by the fact that I did it again, furthermore with a girl that was that attractive.</strong>I certainly could have faced my fears and acted in a way that would lead to having no regrets.<br><br>As much as I think I need to live through the pain of not having been courageous and living to my potential, because I feel like regrets can help me better myself on these insecurities I still have (as well said on this thread by u/Crimboslice5) I feel like there are some ways in which I can alleviate the intensity of the regrets.Part of my regrets would be what I consider futile from a stoic's point of view, but it still affects me in ways I wish it didn't.<br><br>For example, I'm frustrated because I sexually desired her a lot and didn't get what I wanted on that matter.I'm frustrated because I wanted to smash her from behind and feeling the stupid glory of having sex with the best rear from the school.<br><br>I'm frustrated because I don't have the social status and ego boost that I would have gotten from being with this girl and making it known to the world.I'm frustrated because I've always been bad with girls, and I feel like managing to get her in my bed would have raised my self-esteem and the way I value myself.These are, it seems, bad reasons for someone to dwell on regrets, but I can't help but suffer from these.<br><br>I'm starting to get my life back on track, but these feelings and emotions still have great control over me.If you have any advice on how to reduce the way in which these emotions, at least the ones from the paragraph just above, impair my ability to properly function, I'll gladly try and apply them.<br><br>Thank you very much.<br>",appalled,3.0,3.0,3.0
obev56,"<strong>I feel <span style=""background-color:#2dfe5f"">irritable</span>  and can’t sleep.</strong><br>","<em> I’m a big baby.My experience.</em><br><br>First: this Reddit was great to read.Figure I’d contribute.<br><br>I didn’t want to get the jab but I also didn’t want covid.I’m a baby when it comes to this stuff.I’m glad I got it though’<br><br>1st dose: uneventful.Some arm pain.A little tired.<br><br>2nd dose: I’m beyond exhausted.Slight fever.Feel weird.No appetite.<strong>I feel <span style=""background-color:#2dfe5f"">irritable</span>  and can’t sleep.</strong>Some aches and pains.I just took 2 Tylenol.<br><br>Keep telling myself my body is doing what it should.The symptoms started maybe 5 hours after my shot.<br><br>It also messed with my cycle, but I heard that’s normal.<br><br>My tip: move your arm around a LOT after the shot.It helps prevent it from getting sore.:)<br>",irritable,3.0,3.0,3.0
12kbb7w,"<strong>I hate being around humans i have mood swings somedays its good next i frickn hate everyone and the more people talk to me the worse it gets i was in therapy back then bc of severe adhd and my doc told me i have autism i dont know what to do i think 24/7 i dream 24/7 i do nothing il just sit and wait but it gets worse and worse i hate to speak with people at all with nobody i have no ideeaa who i am what im doing on this planet i feel <span style=""background-color:#2dfe5f"">aggressive</span>  i feal fear and anxiety depression mental problems i feel dumb i feel smart i feel retardet i dont know what i feel every single day.</strong><br>","<em> Idk about anything </em><br><br><strong>I hate being around humans i have mood swings somedays its good next i frickn hate everyone and the more people talk to me the worse it gets i was in therapy back then bc of severe adhd and my doc told me i have autism i dont know what to do i think 24/7 i dream 24/7 i do nothing il just sit and wait but it gets worse and worse i hate to speak with people at all with nobody i have no ideeaa who i am what im doing on this planet i feel <span style=""background-color:#2dfe5f"">aggressive</span>  i feal fear and anxiety depression mental problems i feel dumb i feel smart i feel retardet i dont know what i feel every single day.</strong>Its like a mix of all of them together im not like anyone in my age or my surrounding i feel like i belong to nobody i feel like someone who lived a life before and a life from someone else i don't know what to do to say or else.nothing makes sense and everything makes somehow sense i hate this life i love this life i want peace and silence i want to die and to live i want money but i don't want money at the same time i don't like anybody but i feel empty and alone i and if i am with some one i want to be alone i have no fuckIng idea what tf is wrong with me nobody can help me i i i don't know anymore i hate my brain for doing this the only help i have is shuting my brain down with drugs 99%<br><br>weed.I smoke until i feel asleep.I sleep like 12 13 hrs a day.i sit for 3 hours and look into the void.If god exists i hope i never go to heaven i hate him bc im alive if not i hope there is nothing.i dont know im just tired Its impossible for me to talk with someone.Im retarded af im sure this shit doesn't make even sense my english is shit.Doesn't matter anymore.... Its to late for me i cannot work bc i hate humans i don't want to be around them i know i will hurt them idk idk idk idk idk idk idk idk idk idk idk i i i i idk idc anymore bye.first and last post here<br>",aggressive,3.0,3.0,3.0
6p5x3h,"<strong>Even though I feel <span style=""background-color:#2dfe5f"">energetic</span>  during work, I end up feeling super exhausted after 5pm and don't have any energy to do anything besides eat and go to sleep.</strong><br>","<em> alternative to Ivysaur's workout routine?</em><br><br>Hey r/fitness,<br><br>are there less strenuous alternatives to Ivysaur's workout routine?<br><br>Link: https://www.reddit.com/r/Fitness/comments/4uijsl/a_detailed_look_at_why_stronglifts_starting/?st=iwb9a8u1&amp;sh=321ed736<br><br>I'm asking because as much as I love the program itself, it really drains me at 6:30am in the morning before my 8-5 job.<strong>Even though I feel <span style=""background-color:#2dfe5f"">energetic</span>  during work, I end up feeling super exhausted after 5pm and don't have any energy to do anything besides eat and go to sleep.</strong>I'm working on a couple business ventures on the side so this really gets annoying when after-work hours are all I have lol.<br><br>I used to do StrongLifts but the squats were too intensive/boring for me and i started moving towards more non-leg heavy workouts.Ivysaur is getting me great results, but perhaps the weights are too heavy leading to exhaustion later?Anyone else with this problem?<br>",energetic,0.0,0.0,0.0
937isl,"<strong><em> (20) I just want compliments because I feel <span style=""background-color:#2dfe5f"">dorky</span>  with my glasses.</strong><br>","<strong><em> (20) I just want compliments because I feel <span style=""background-color:#2dfe5f"">dorky</span>  with my glasses.</strong></em><br><br>[deleted]<br>",dorky,3.0,3.0,3.0
9s8md7,"<strong>I feel <span style=""background-color:#2dfe5f"">traumatized</span>  by what I did to myself.</strong><br>","<em> My fetish ruined my life </em><br><br>I'm 24 and still a virgin and have never had a girlfriend.I have a humiliation fetish that involves me getting off on being humiliated in diapers and dresses.<br><br>I thought I could just accept this fetish as a harmless thing and it wasn't a big deal.I thought maybe I just need to find the right woman or something.But it has caused me tons and tons of pain.Growing up I had no friends.I was picked on and teased.I was put on medication and taken to therapy.Every day I would masturbate to fantasies of diaper humiliation.This fetish caused me to isolate myself and keep quiet because I didn't want anyone to know my secret.I was shy and quiet and scared of other kids because I didn't want them to know my secret.<br><br>I thought I could just accept it and move on.But I just couldn't.It just caused me nothing but pain and misery and I wanted to quit.I tried throwing my panties and diapers away, but it just never worked.I kept returning back to my fetish.<br><br>Growing up I did a lot of shameful things to get off.I remember crossdressing at around the age of 8 or so.For some reason, I just had this strong urge to wear a skirt.And things just built up from there.I used towels and doggy training pads and stapling them together to create a diaper.I remember using towels and my sister’s puffy jacket to create diapers.I remember shitting myself and pissing myself in the shower.I remember wearing multiple pairs of tighty whities to create a diaper.All these shameful things I did growing up, feel like trauma.<strong>I feel <span style=""background-color:#2dfe5f"">traumatized</span>  by what I did to myself.</strong><br><br>I just feel sick to my stomach thinking of this stuff.It really haunts me that I did all of these shameful things to myself.I’m embarrassed by myself.And I remember cumming all over a canvas in my room and calling it at one time, and my mother finding it and being disgusted.I was a fucked up kid growing up.<br><br>My relationship with my mother is strained.It’s hard to look her in the eye with her knowing all of these horrible things about me.She still loves me no matter what, and I just feel so ashamed of myself that I just want to die.<br><br>I’m just so fucking ashamed of myself for growing up like this.I thought I could just accept this as a simple fetish.But it just doesn’t feel like it.I thought I could join Fetlife and meet other people like me, but that just isn't going to solve anything.<br><br>I’m ashamed of myself for growing up and masturbating every day to fantasies of diaper humiliation.I’m just so sick of it I just want to stop.<br><br>Everyone always says I look so sad or upset.At work, I was told by multiple people that I look sad, upset, miserable and bored.My coworker asked me why I look so sad and upset and asked what was wrong.My manager said he was worried about me.<br><br>It’s not like I can tell people why I’m depressed.I’m depressed because I have a fetish that ruined a lot of my life.I just can’t talk to people about it.I feel alone in the regard.<br><br>I feel like my diaper/crossdressing humiliation fetish caused the majority of my depression.I felt alone.I felt like a freak.I grew up doing these horrible and embarrassing things to myself, I feel so fucked up and warped from the damage I did.<br><br>How do I become comfortable with my family?Yeah, I go with my parents to the movies, but I still feel…ashamed of what they know about me?I just feel upset they know something I don’t want them to know?They still love me, but….I have a hard time loving them back and it breaks my heart…and I feel it’s all because of this stupid fetish.<br><br>Why did I grow up wanting to humiliate myself so badly?What’s the reason for that?<br><br>About two months ago I decided I had enough.I was just sick of everything and wanted to change.So I threw away all my diapers, dresses, panties, dildos, bras, and rubber PVC suits into the trash.I just had enough.I stopped masturbating for two months now and I just never want to return to that darkness.<br><br>I hate how people say you should love yourself and accept yourself for what you like.Life is short, so enjoy yourself and accept your fetishes.But that's not who I want to be.I don't want to grow up any longer with these fetishes holding me back in life.<br><br>The worst part about this is my family knows.My sister found all my diapers and was disgusted and threw them in the trash.I meekly just fished them out of the trash and put them back in the box and hid them in the basement.<br><br>I just wish I never had this fetish since it caused me so much self hate and loathing.No woman is going to enjoy humiliating her SO in diapers and love them.Okay, sure...maybe there will be someone out there, but it's just an unrealistic fantasy.<br><br>I also HEAVILY watched humiliation porn.I watched diaper porn just about everyday.I looked at cartoons and hentai depicting diaper humiliation.I read erotica and comics involving this fetish.I even spent money on porn videos and also dominatrixes.I've just been through a lot.I got very DEEP into this fetish.<br><br>I just...wanted to stop indulging in this stupid fetish which does nothing good for me.If it was acceptable, I wouldn't be feeling so depressed and suicidal over it.Yeah, I feel suicidal over a fucking diaper fetish, isn't that insane?<br><br>Just look at my post history and see how fucked up I am.I'm miserable, lonely, and depressed.I only have one friend and he has NO idea about all of this fetish.I don't want him to ever know because he would look at me differently.Maybe in the future years from now, I can just say ""Hey I used to have a fetish for humiliation, but I changed my way of thinking and don't get into that stuff anymore""<br><br>I just want to be happy.This fetish makes me very unhappy, so I quit.<br><br><br>",traumatized,3.0,3.0,3.0
4tavqv,"<strong>I know it's a huge commitment, but over these months, I've gathered strength and I feel <span style=""background-color:#2dfe5f"">deep</span>  inside that I can make it.</strong><br>","<em> NoFap has showed me what my real addictions are.Now it's time to quit them all.Engaging ""Pure mode"".</em><br><br>I've discovered my issue with porn 7 months ago and I've been doing NoFap for that long.I've had some successes, many relapses, but throughout this journey I've become aware of my other addictions.Other than porn, these are: video gaming, computer and internet use(including social media, youtube, facebook) mindless, trance-like ""automatic"" browsing.In other words, I'm addicted to the screen.But all these end today when I'm starting the most hardcore and efficient rebooting process I can do.I call it ""Pure mode"".This includes: Nofap hard mode, minimum computer use(maximum 1 hour/day with no video games and wasting time), personal improvement, reading books, working out, taking care of my diet(no sugar, no alcohol, no processed food), meditating, outdoor activities, playing my instrument, cleaning my house, socializing and obviously no mobile phone cheating.In other words, only productive and non-artificial work.Being the ruler of my life, not just an observer.For those interested in updates, please leave a comment and I will respond to you in a week with updates on my progress.<strong>I know it's a huge commitment, but over these months, I've gathered strength and I feel <span style=""background-color:#2dfe5f"">deep</span>  inside that I can make it.</strong>Totally convinced.Now, I can avenge all those relapses.I like visualizing the new me beating the hell out and taking over of the old me (a lazy, addicted BOY scared of life).This is me becoming a MAN and this is not empty talk, I am making this commitment to you guys and to myself.<br><br>Lastly, but not last, I'd like to thank everyone in this community for sharing their thoughts, stories and the friendly, positive brother-like attitude that exists in this subreddit.I feel at home here fighting together with you.Good luck to all of you in your journey and stay strong !Signing out.<br>",deep,0.0,0.0,0.0
f1wxv1,"<strong>So is that something I take everyday or just when I feel <span style=""background-color:#2dfe5f"">anxious</span> ?</strong><br>","<em> Prozac?</em><br><br>30f no known health issues besides anxiety.<br><br>Ok so I’ve posted on here before about my health anxiety.I went to the doctor this morning, she is a doctor I have never seen before (I have recently switched insurance and had to find a new primary).I went just for a yearly checkup but did want to discuss some of my fears and worries.Well when I tried she rushed me through and mostly just focused on my weight.I am overweight but she just made stereotypical assumptions (I eat crappy food and never seen a vegetable) so I reiterated that I have health anxiety and wanted to talk about it and again she just didn’t listen and just said “ok so you want anxiety pills” which yes I did want something but not the way she said it (if that makes sense).She didn’t even tell me what she prescribed me, had me get blood work and I never seen her after that.I asked the nurse before I left what I was prescribed and she said she didn’t know either and she would call me.Well she didn’t call me.I just got a text from my pharmacy letting me know I had a prescription ready so I called and it’s Prozac.<strong>So is that something I take everyday or just when I feel <span style=""background-color:#2dfe5f"">anxious</span> ?</strong>I used to take Zoloft while I was pregnant (I no longer take it) but have never taken any other anxiety medication before.And is that normal for the doctor to be so dismissive?She didn’t do anything other than look in my ears and in my mouth.After that NOTHING.Oh and she did listen to my heart and lungs.<br>",anxious,3.0,3.0,3.0
20kwwl,"<strong><em> Mom i'm feeling <span style=""background-color:#2dfe5f"">sick</span> , take me to the doctor </em></strong><br>","<strong><em> Mom i'm feeling <span style=""background-color:#2dfe5f"">sick</span> , take me to the doctor </em></strong><br><br><br>",sick,1.0,1.0,1.0
3xrdcc,"<strong>I feel <span style=""background-color:#2dfe5f"">lonely</span> , especially since i am a guest and the whole point of me being there is to spend time with him.</strong><br>","<em> My [F/25] boyfriend [M/24] would rather stay up and play video games instead of coming to bed.Together 2 years.</em><br><br>My boyfriend and I had an evening routine where we'd watch youtube videos or movies before bed.This was our time to cuddle and be intimate.I'd eventually fall asleep and he was free to stay up as late as he pleased.<br><br>Before moving in with his room mates, I asked him if our routine would change?I asked if I'd be going to bed alone now that he was living with his buddies, who he games with.He promised our routine would stay the same.<br><br>He's been living with his room mates for under a month now and in the 7 times I have slept there, we have gone to the bedroom together once.I brought it up, asking why I am finding myself in bed, alone, at his apartment and he said it is because he doesn't have the WiFi set up and we have nothing to watch.I figured that made some bit of sense and let it go.That was 2 weeks ago.They are all broke and the Internet won't be connected for a long time.<br><br>Our sex life is dead.I am used to having sex 2-3 times a night.I can count on 3 fingers the amount of times we have had sex since the move.<br><br>Tonight, I said I was sleeping over only if he came to the bedroom at the same time.I said I was tired of going to bed alone.<strong>I feel <span style=""background-color:#2dfe5f"">lonely</span> , especially since i am a guest and the whole point of me being there is to spend time with him.</strong>I reminded him of his promise and he replied with ""I never promised you that.I'll go to bed whenever I want.Sorry.""<br><br>I can't imagine continuing to have such a dead sex life.I can't imagine having no more ""we"" time.I don't know how to ask him to compromise.I don't want to attack his video games, but I feel like they're the priority over me.What do I do?<br><br>Tl;Dr: boyfriend stays up late every time I'm at his place and our sex life is dying.I hate the disconnection it's creating.How do I approach this situation?<br>",lonely,3.0,3.0,3.0
