id,short_context,full_context,emo_term,affect_score,affect_score_a,affect_score_b
dyfi0g,"<strong>I feel <span style=""background-color:#2dfe5f"">miserable</span>  and overwhelmed but I know that everyone will look down on me if I don't get a degree or if I drop out of school.</strong><br>","<em> School, no friends, I'm exhausted.</em><br><br>I've just been feeling awful the past few days.I'm in my first semester of college and it's killing me.The semester ends \\~dec 13th and im failing one class so awfully I don't think I can fix it.I haven't made any friends, and I have to move out of my current dorm, so i have to talk to ppl who have an open space.Everyone thought that I would do so bad and at first I was doing so well (im the first of my siblings to dorm) but now it's just been awful.<br><br>I feel completely alone and overwhelmed.I keep talking to my sister abt it, but she's halfway across the country and probably getting fed up with me so I don't want to bother her anymore.She's been saying I should go to counseling at my school, but it took me months to warm up to my therapist (who ive been seeing the past \\~3 years but am now only seeing on a monthly basis) so i dont think id be comfortable talking to them.<br><br>My mom said to me earlier in the semester that if I fail any classes she'd pull me out of school and honestly I can't help but think that'd be better than staying here.I hurt myself for the first time in months (and the first time since i started on meds) and i just feel like crying every day.<strong>I feel <span style=""background-color:#2dfe5f"">miserable</span>  and overwhelmed but I know that everyone will look down on me if I don't get a degree or if I drop out of school.</strong>I feel like dying would be easier just so I wouldn't have to worry about the future.I'm also nervous bc I am at a relatively expensive school (nothing insane but its not cheap) and id feel awful about wasting so much money.Also, I'm so grateful that my mom has been paying for therapy and medication for me but it just feels like she doesn't understand.She always feels that I'm being ridiculous or lazy when I just can't do things.Like when I first started this semester, she was always telling me to go to events not understanding how difficult and stressful it is for me.And idk if issues with empathy is a side effect of depression, but she gets mad at me for that too.<br><br>Idk.I might try to talk to my mom about how I've been feeling, but it's always so hard to articulate wheat I'm trying to say with her and she always just shuts me up.or cuts me off.or invalidates me in another way.And my dad is even more impossible to deal with.and one of my sisters is halfway across the country (u.s so its far as fuck).and my other sister has a full time job and a bf soon to be fiance probably and its just awkward talking to her sometimes since she's like 5 yrs older than me and very outgoing (even tho shes the only other one in my family thats self harmed).<br><br>So yea.sorry that this is long and all over the place i just dont know where else to turn or what to do.<br>",miserable,3.0,3.0,3.0
94vhev,"<strong>But I feel <span style=""background-color:#2dfe5f"">reluctant</span>  to reform Poland as it feels like I would go from looking like a quite successful Silesia to a quite sad and small Poland when reforming.</strong><br>","<em> Suggestion: allow keeping color when reforming a nation </em><br><br>I'm currently playing as Silesia to get the ""back to the Piast"" achievement.<strong>But I feel <span style=""background-color:#2dfe5f"">reluctant</span>  to reform Poland as it feels like I would go from looking like a quite successful Silesia to a quite sad and small Poland when reforming.</strong>I realized that being allowed to keep my color and turning into a bright green Poland would allow my to feel like I achieved something special, and be a visual reminder of my past.What do you guys think?<br>",reluctant,2.5,2.5,2.5
7origm,"<strong>As I still go to the gym I feel <span style=""background-color:#2dfe5f"">exhausted</span> .</strong><br>","<em> Food on a budget (micronutrients question) </em><br><br>Hey everyone!I've lost about 5 pounds since my last post by just counting calories, now I want to really focus on eating healthy.<strong>As I still go to the gym I feel <span style=""background-color:#2dfe5f"">exhausted</span> .</strong>What should my macronutrients be while I'm trying to lose weight and what foods should I eat on a budget.<br><br>My current diet that I just tried to start is Oatmeal in the morning, chicken breast and a salad for lunch, protein bars as snacks, and whatever for dinner.<br><br>I really want to incorporate more fibers proteins etc, just not good with what I should buy on a budget.<br><br>Thank you everyone you've been a blessing!<br>",exhausted,0.0,0.0,0.0
3cnj8x,"<strong>As a result, I feel <span style=""background-color:#2dfe5f"">irritable</span>  in the situation because I am so on edge, &amp; I avoid walking down busy roads.</strong><br>","<em> Any social anxiety sufferers want a fellow social anxiety sufferer as a friend?</em><br><br>Hi, so it would be nice to inbox a friend who understands how I feel day-to-day.I guess, a good example would be walking down the road.I feel like the drivers in cars going past have this privileged view where they can view me in my entirety, but I can't see a part of them.I had an ex who was a complete loser &amp; thought it was funny to insult pedestrians he saw as he drove past.Now, I am not narcissistic or delusional enough to think that every driver who passes me devotes their time &amp; attention to saying how horrible I look, but the feeling looms nevertheless.<strong>As a result, I feel <span style=""background-color:#2dfe5f"">irritable</span>  in the situation because I am so on edge, &amp; I avoid walking down busy roads.</strong><br><br>So anyway, that's an example of my life &amp; how fun it is.If you would like to chat on here, maybe, just to have some common ground &amp; get out all of those Social Anxiety anecdotes noone else will find funny (but instead probably sad), then PM me?<br>",irritable,3.0,3.0,3.0
upmkcg,"<strong>I feel <span style=""background-color:#2dfe5f"">wide</span>  awake and the euphoria is good.</strong><br>","<em> Second time doing blow </em><br><br>Not tryna get too fucked up, I've got a line ready and I'm taking it bump by bump, feeling great, getting some shit done, it's a smooth weekend.<br><br>The drip (edit : just realized that the discomfort was because the back of my throat had gone numb...took me longer than I'd like to admit to realize this...) is annoying and the coke is mid.It's allegedly better than average but that shit came in powder and tiny ass rocks, and it's also cut with amphetamines, which I don't actually mind that much but you're not gonna get me to believe this is what actual good coke is.<br><br>I'm pretty sure it's cut with this because I've tested it with Mecke, Marquis and Simons.Two of these shouldn't have reacted if it were pure cocaine.Don't exactly remember which ones did what because I don't have that kind of memory and I just look at the chart when reagent testing, but the testing indicated the presence of amphetamines.Fent strip turned back negative which is always good.Of course I can't be certain given the fact that fent can be in hotspots and a sample can test negative whilst another can test positive...Anyways...<br><br>There's definitely some blowcaine in it tho.Also my face feels numb and so does my ass.<br><br><strong>I feel <span style=""background-color:#2dfe5f"">wide</span>  awake and the euphoria is good.</strong>Have a nice weekend comrades.<br>",wide,1.5,1.5,1.5
5zkb61,"<strong>(this was the dorkiest post ever, and I feel <span style=""background-color:#2dfe5f"">gross</span>  about it)</strong><br>","<em> 29 [F4R] Glitchy private servers have their charms </em><br><br>It snowed.I have a snow day.S'no joke.<br><br>Currently playing FFXI alone on a private server (population: 2,) riding the ship to Mhaura, hoping the ghost NM that I need to kill for NIN AF pops.If any of this makes sense to you, first off, gg nerd, and secondly, you can safely assume I'm {Impossible to gauge!}levels of awesome/insane.<br><br>PM me your kik name and &lt;job&gt; and maybe we'll be pals.<br><br><strong>(this was the dorkiest post ever, and I feel <span style=""background-color:#2dfe5f"">gross</span>  about it)</strong><br>",gross,3.0,3.0,3.0
57mdp8,"<strong>I feel <span style=""background-color:#2dfe5f"">lonely</span>  and really wanna find an older man for fun and pleasure and also for serious relationships if he is willing to commit!</strong><br>","<em> 24 [F4M] Beautiful Ukrainian girl looking for Mature Older Guy to have fun and pleasure, KIK &gt;&gt; hottie4cherry </em><br><br><strong>I feel <span style=""background-color:#2dfe5f"">lonely</span>  and really wanna find an older man for fun and pleasure and also for serious relationships if he is willing to commit!</strong>Kik me - hottie4cherry<br>",lonely,2.5,2.5,2.5
1acjv3b,"<strong>I feel <span style=""background-color:#2dfe5f"">jittery</span>  waking up but its probably left over anxiety.</strong><br>","<em> Vibration pulsing when falling asleep in chest and face </em><br><br>49yo 5'11 190lbs man.I have a vibration pulsing thing happening when im trying to sleep its making me crazy.....It starts when im about to fall asleep and then ill start to feel a vibration jitter in my chest, then it starts in my face.It instantly stops me from falling asleep.Once It starts I can lay there and feel it until I move.It actually felt like it was rhythmic pulsing on my face.It doesnt always start in the chest tho, sometimes its just the face.Not sure if someone would be able to see it or not but probably not.It happens on and off all night and when I wake up...<strong>I feel <span style=""background-color:#2dfe5f"">jittery</span>  waking up but its probably left over anxiety.</strong><br><br>Ive taken my blood pressure when it started to happen but like I said its hard to catch because as soon as I move it basically stops.I've seen it a few times at like 95/50's and the lowest ive seen was 95/49.... most of the time tho it is like 106 over 60 when im laying down.<br><br>Ive tried to catch it with a kardia ekg thing also but it always stops happening by time It is scanning...<br><br>The Dr blamed it on caffeine and not enough exercise, well I stopped all caffeine and walked every day for 2 months it didn't fix or help it.<br><br>It's making me crazy!<br>",jittery,1.0,1.0,1.0
969hpj,"<strong>We have sex, but I feel <span style=""background-color:#2dfe5f"">jumpy</span> .</strong><br>","<em> How long should I wait for him?[advice] </em><br><br>I [33F] found out last week that my spouse [44M] has had a gf for two months.We’ve been together for 10 years.He says he is trying to choose.<br><br>I’m still nervous he won’t pick me.I’m scared.I told him I accept him (he might be poly).I haven’t given him an ultimatum, weirdly the other girl did.We haven’t had any fights- there wasn’t any problems that we had.I feel sucker punched.<br><br>He gets into bed with me and hugs me, says he loves me.But once he leaves for the morning and then comes back from work, he calls his gf.I am trying not to be overbearing.<strong>We have sex, but I feel <span style=""background-color:#2dfe5f"">jumpy</span> .</strong><br><br>Tl;dr - Husband has gf, I don’t know how long I should wait.I’m so tired.<br><br><br>",jumpy,3.0,3.0,3.0
csxfid,"<strong>A lot of times, I feel <span style=""background-color:#2dfe5f"">traumatized</span>  by how my family treated me when I was growing up.</strong><br>","<em> I don't know how it got this bad.</em><br><br>Or maybe I do.<br><br>Ever since I was young, I've always had problems being around people.There were periods in my childhood/adolescence where my level of anxiety fluctuated, but as a whole, I would never venture outside of the social barriers I had.I was constantly told growing up that it would get better as I aged, that ""nervousness/shyness"" was just something young people felt, that it was just a byproduct of teenage angst.Yet, I'm now 25 and I feel so much more anxiety than I did when I was in high school, another bad period of my life.It's gotten to points where I actively avoid my siblings (I live with my parents still and they regularly visit) when they come over, skipping a meal or two for the day.<br><br>Because of my extreme fear of being around family, I stay upstairs almost 24/7, only going downstairs to sneak a meal in the middle of the night.For more than 8 years, my body has attuned to a 25-hour sleep cycle due to when I eat, looking at the computer screen/light all day/night, and lack of physical exertion.I can't function like a normal human being for more than a day, and during my brief moments where I show signs of improvement, I go back to the same old routine...sleep, wake up, use the computer, eat at 3AM in the morning, go back to sleep.<br><br>When I say I can't function, I literally can't.I have never held down a job, I'm degree-less, and I have no skills.I'm worthless to any company.I would be a nervous wreck who struggles at the slightest sign of any work-related pressure.I have no basic knowledge of how to handle everyday finances.My anxiety has kept me from starting, let alone completing, almost all the milestones of adulthood, and it doesn't show signs of letting up.<br><br>And everyone around me is aware of it.Yet, they're okay with it!They enable me to be this way!I keep being told ""you can't do this alone"" but whenever I ask for help I get no answers or we get into a big argument and afterwards forget and go back to the same old cycle.I'm just a skinny lanky man-child who hides in his room and sneaks downstairs for scraps like a common mouse.<br><br>The mantra I like to repeat to myself to cope is ""I'm so stupid.""Whenever I think of a past moment that makes me cringe at how embarrassing or stupid I was, that's what I say to myself quietly.I've lost count of how often I've said it.It's a bad thing to keep saying, but it comforts me knowing that I at least am self-aware about that aspect of me.Sometimes I say it angrily.Sometimes I say it in the stupidest accents I can think of.It's also now my personal catchphrase when I catch myself saying something I wanted to retract but now can't because it's now said out loud.<br><br><strong>A lot of times, I feel <span style=""background-color:#2dfe5f"">traumatized</span>  by how my family treated me when I was growing up.</strong>I always remember how they emotionally abused me and kept me feeling down and wanting to die.Now that years have passed, they've ""moved on,"" but I haven't.I still remember the times when I asked for advice and emotional support and they shunned me for any combination of reasons.It's like I'm continually stuck in the past while they're free and unburdened.I wish I could move on too.<br>",traumatized,3.0,3.0,3.0
ri3ek8,"<strong>Whenever I remember how good attraction to women felt I feel <span style=""background-color:#2dfe5f"">gross</span>  (For example, I had a lesbian dream, and as soon as I woke up I was feeling great and thinking ""that was a good dream"".</strong><br>","<em> I'm having trouble with accepting that I might be lesbian </em><br><br>So to make this as quick as possible I've been having issues with the LGBT community and the possibility that I'm a part of it.I was pretty confident I was lesbian in late 2020 and early 2021.However, now I'm having issues accepting what my friends say is ""obvious"".<br><br>I know for sure I want to have a girlfriend and in the far future, a wife.However, certain situations make me wish I were attracted to boys, so I think I've begun to imagine an attraction to a guy in my school.I told everyone I liked him to dissipate any rumor around my sexuality, and I've been eyeing him and talking to him.I know I don't like him and I shouldn't hurt him pretending that I do, but I want to be straight.<br><br>My dislike has gotten to the point where seeing lgbt stuff easily makes me turn away.<strong>Whenever I remember how good attraction to women felt I feel <span style=""background-color:#2dfe5f"">gross</span>  (For example, I had a lesbian dream, and as soon as I woke up I was feeling great and thinking ""that was a good dream"".</strong>However a while later the feelings of ""grossness"" came back to me).I really hope this makes sense.<br><br>I really want to be in terms with it again, but at the same time I wish I were straight so everything would be easier.<br><br>The ""Advice"" I need is on what to do with this conflict.<br>",gross,3.0,3.0,3.0
2vyli0,"<strong>I'm sure the answer is 'suck it up, get a job, go fuck yourself' but, I feel <span style=""background-color:#2dfe5f"">paralyzed</span> , unable to do this because of my own fear.</strong><br>","<em> Just general words from a stranger, if you don't mind sharing.</em><br><br>Hello advice I know a lot of threads are swimming around that probably sound a lot like this one, but I just need the thoughts and help of a few strangers, if you don't mind sharing some time with me.<br><br>I am a 26 year old, single, white male, unemployed, wannabe analog game designer.I also have passive-depressive mood swings and take Effexor 100 to keep me stable.<br><br>I left my last job as head of air operation security at a military base (can't tell for obvious reasons) almost a year ago because of a few reasons.Mostly due to the fact that I was the /only/ air operation security person at the only terminal, so 100% of flights (including medivac planes at 3AM) were my responsibility.That, coupled with the isolation of the base, and just general loneliness caused me to leave after 5 years of solid work.(And no, before you ask, I haven't saved any dosh.)<br><br>I decided to leave and try to work on my craft, to design some games, get better all around, and generally try to swap careers.<br><br>I moved in with my family and got to work.Thankfully I have loaned them enough money that they don't bother me about rent or food, so I don't need any of the amenities taken care of, as long as I don't mind whatever they get to put in the fridge.<br><br>Obviously I am not living in a hovel, nor am I in a super bad way.<br><br>However this is coming to an end.<br><br>There's a nebulous 'endgame' that my folks are talking about, and I don't really know how to approach it.Mostly due to the fact that analog game design hasn't really paid any bills... or earned me much in any way at all.<br><br>My problems are twofold in this respect:<br><br>After being in a relatively abusive job for the past 5 years, I don't want to work for anyone else again.Or rather, I hate the fact that since this is an employer's market right now, bosses can continue to treat employees like shit, and finding new jobs are tough.I admit I am a bit paranoid, but the thought of being at the beck and call of an employer again makes my emotions fly all over the place.<br><br>Secondly, I feel like whatever I do when it comes to game design is never enough?I mean frankly I've been told I do alright, but in the end not even making enough to keep my 'company' website afloat gives me worries.I feel like if I were smarter I would just whore out and do '100 Vaginal Sounds' pdfs just to get money in my pockets.<br><br>I spend most of my days just rolling out of bed and cramming the computer into my face, mostly watching shows or movies just to keep me out of reality, and not thinking about the inevitable future.Even if the 'endgame' isn't a real thing, I can't live like this forever, it just won't work...<br><br><strong>I'm sure the answer is 'suck it up, get a job, go fuck yourself' but, I feel <span style=""background-color:#2dfe5f"">paralyzed</span> , unable to do this because of my own fear.</strong><br><br>I could go on and on, but I'll leave it here unless someone asks.<br><br>Thanks in advance!<br>",paralyzed,3.0,3.0,3.0
hdsnjd,"<strong>Every one I talked to said speak to your family, everything felt the same answer that work with everyone but me a cure with no effect, I feel <span style=""background-color:#2dfe5f"">defective</span>  like I’m meant to be happy but I just don’t</strong><br>","<em> I don’t really know </em><br><br>Hey my life has been a mess and I hate typing about you life because I’m living a life without having to worry about money so I always feel bad for going ahhhh my life sucks when other people have it much worse<br><br>I go to a boreding school, it’s all right but it makes me do activities that I’m not comfortable with all The time<br><br>I didn’t handle going to boreding school well, I always missed home and I didn’t get into a group of friends until the end of the term<br><br>Every day I sat alone, people would walk by and would say anything soon I felt like a ghost and I started to have suicidal thoughts, everyday I had these thoughts, over and over again the words “your not good enough, no one cares, you should just die already, all you are is just a parasite, no one would noticed if you disappear”<br><br>Every day this happened for 11 or more weeks straight, I just felt hollow like I was just a empty shell faking it’s emotions, soo I went to the school counsellor when I talked about my suicidal thoughts she said that she would tell the school and I thought that the school would now check up on me and see if I’m okay doing certain activities but no not a single word, nothing happened, I felt more alone after that, being in groups of people feel even more lonely and made me feel like I was just copying emotion to try and be normal, it just got worse<br><br><strong>Every one I talked to said speak to your family, everything felt the same answer that work with everyone but me a cure with no effect, I feel <span style=""background-color:#2dfe5f"">defective</span>  like I’m meant to be happy but I just don’t</strong><br><br>My family is a no go, I upset my mum when I talk about it so I don’t like talking about it with her, my dad gives me solutions with no effect and my brother doesn’t seem to care about me at all<br><br>I’m not saying my family are bad people, I’m sure they love me but I just don’t feel like anyone<br><br>cares<br><br>It’s been like this for 3 years and it’s still going on, I thought I might as well try and let my emotions out<br><br>Sorry it’s so long<br>",defective,3.0,3.0,3.0
su75wv,"<strong>I've had huge dogs come over to say hello and I don't feel <span style=""background-color:#2dfe5f"">nervous</span>  at all; maybe because part of me has also gotten better at reading dog body language so I can judge their moods too.</strong><br>","<em> I think my puppy has cleared my lifelong phobia of dogs - and not just for himself!</em><br><br>So this is just something I've been thinking about now my boy is turning a year in four days.<br><br>My parents had a Rottweiler when I was very young who accidentally knocked me over trying to get the ball I had in my hand.That day left me with a phobia of dogs of all sizes but especially big dogs; I'd always freeze up around them and get incredibly anxious and uncomfortable.<br><br>There've only been a few dogs across my life I've gotten over that phobia with (my local wargaming store had a litter + the parents for example that I basically grew up with from when they were 1 year old in 2005 and I was in my early teens, the last one just passed away last month) but thats it.<br><br>Well since getting my pup - he's neither especially big or heavy - my phobia has basically vanished.I no longer view dogs in terms of *me*; I view them in terms of him, and I think that was a *massive* game changer.<br><br>I'll be pointing out dogs to myself to keep an eye of when to leash him due to recall, or turning a dog passing into a sit-and-watch-me exercise to keep his focus.Even when dogs *do* come up I don't flinch away or get anxious; at most I'm concerned for my boy in case anything did happen!<strong>I've had huge dogs come over to say hello and I don't feel <span style=""background-color:#2dfe5f"">nervous</span>  at all; maybe because part of me has also gotten better at reading dog body language so I can judge their moods too.</strong><br><br>That's really it!Thanks.<br>",nervous,3.0,3.0,3.0
jjc9z8,"<strong>I feel <span style=""background-color:#2dfe5f"">agitated</span>  and anxious when I actively try and sleep.</strong><br>","<em> How do I sleep </em><br><br>I’ve always had trouble sleeping.In 20 and smoked a lot of weed as a teen which messed up my sleeping routine.<br><br>Today even with sleeping pills I struggle to drift off.I fixate so much on the moment of transition from conscious to unconscious.<strong>I feel <span style=""background-color:#2dfe5f"">agitated</span>  and anxious when I actively try and sleep.</strong>I just can’t do it.<br><br>My poor sleep does a real number on my mental health.Please any tips or mental practices or advice would be appreciated.<br>",agitated,2.5,2.5,2.5
