id,short_context,full_context,emo_term,affect_score,affect_score_a,affect_score_b
257r06,"<strong>Found out my gf has been lying to me about all kinds of shit, she bailed on her trip out here to see me on her birthday making up some lame excuse, and now I'm feeling <span style=""background-color:#2dfe5f"">shitty</span> .</strong><br>","<em> [m4f] 28 m in SF having the worst month, need a good BJ, will reciprocate </em><br><br>It's been the worst month.<strong>Found out my gf has been lying to me about all kinds of shit, she bailed on her trip out here to see me on her birthday making up some lame excuse, and now I'm feeling <span style=""background-color:#2dfe5f"">shitty</span> .</strong>I am in fire need of a BJ, perhaps something more.Will reciprocate.I'm frequently told I'm a good looking guy, but my self esteem has just been crushed, so here I am... Ladies?<br>",shitty,3.0,3.0,3.0
95mbbf,"<strong>This is for no self-serving need; rather, I feel <span style=""background-color:#2dfe5f"">deep</span>  in my bones, deep in the cavern that exists within me, that there is a purpose I have been working towards my whole life, and for the first time, all of my actions and interest before shamanism make clear, indelible sense.</strong><br>","<em> Power cultivation (philosophical advice welcome, as is ""physical"") </em><br><br>Hello, my friends.<br><br>This post is about to be long.I don't expect many of you to read it, and I don't truly expect to get input; this is simply a grounded call into the dark to see what turns up.<br><br>I have done quite a bit of shamanic training with a teacher (who quite literally found me randomly in a public place) in terms of journeying to speak with animal spirits and have since realized that she was a temporary teacher for me; I know what I have learned from her is the extent of what I am supposed to.Not that I have ""learned it all"" - far from it - I just know I have learned ""all I am supposed to"" from this one particular instructor.<br><br>I am writing here in hopes that some of you who have gone through an apprenticeship will be able to assist me in my next step forward as I feel I am on the verge of discovering my next (hopefully permanent) teacher and the said discovery is predicated on my next individually-made-step.<br><br>**\\*\\*\\***First**\\*\\*\\*** some notes for context**:** the first time I journeyed was unintentional and I had no idea what journeying or shamanism was.In-fact, I didn't consider forms of spirituality as anything more than an almost shameful curiosity.I slipped into what I now know to be called a journey and was traveling through the middle world.I looked around me and noticed I was being *followed by an animal that felt benevolent*.Long story quite short, I then floated upward through a stark-white tunnel and roamed the cosmos before<br><br>I came to.This lasted about 2 hours.Fast forward a year or so later I did a ""Crown Chakra"" journey with my past teacher, fully expecting (I know this is the wrong way to go into it) a specific animal to be there.Much to my surprise, it was *the same animal I saw on my first unintentional-journey*.<br><br>Now, when I call on that animal, I feel his (it's a he) energy shift through the room and myself.Through working with this animal I have found that I need to work on growing my power.<strong>This is for no self-serving need; rather, I feel <span style=""background-color:#2dfe5f"">deep</span>  in my bones, deep in the cavern that exists within me, that there is a purpose I have been working towards my whole life, and for the first time, all of my actions and interest before shamanism make clear, indelible sense.</strong>I am a mediator between worlds, I work to help bridge the gap between the ethereal and the physical, and I work on behalf of the energy my animal represents to clear darkness from the world and assist the earth as a whole to grow forward; not just the humans, but the animals, the plants, the trees, the stones: the energy as a whole.<br><br>**Another side note** \\- when I was born I lived some time in excruciating pain.Long story short, I had an organ issue that was corrected surgically.This is not the kind that definitely would have killed me, although it *could have.* The issue itself was quite rare and, the fact that I even felt it, was even more rare; most people with this issue never know they have it - I did.Without going into detail, my intestines were never ""tacked down"" in my body and were free-floating.My intestines, through digesting food and body movements, had tied themselves into knots and were killing tissues.If it didn't kill me, I would have lived the rest of my life in extreme pain, yet lived a full life, so my family elected to have it corrected surgically.To me, this makes sense as that near death experience that I hear of as being the precursor to the shaman's call.<br><br>Now for my ""ask""... as said above, I am interested in learning to grow my power.I am stuck on how to do this, I cannot tell if the answer is philosophical (as in, remove the ego from the self and touch the pure you) or if it is physical (as in perform a certain energetic action).All I do know is that I will know what feels right when I feel/hear it, and that ""right"" action will bring no pain to anyone else and have no dark connotation.This is me.This is who I am.<br><br>I am not sure why I am typing this up in this way, this is not usually the manner in which I speak, so maybe this has something to do with it as well.<br><br>I welcome questions and will gladly answer them so long as they are the type of questions I *should* answer.<br><br>Thank you for your time,<br><br>\\-brnngwng-<br>",deep,3.0,3.0,3.0
1zc5kc,"<strong>I feel <span style=""background-color:#2dfe5f"">manipulated</span> .</strong><br>","<em> I am accused of robbing four banks.</em><br><br>I'm not sure where to begin.The last few years of depositions have been a hot mess.I have learned that the FBI analysis shows the robber is 5'10"", and my medical records show I'm 6'1""... and yet, my lawyer thinks this is difficult to bring out in the trial, and may not be sufficient proof... somehow.<br><br>I am a white guy.Bit pudgy.Balding, and I had a goatee at the time.The robber wore very nondescript clothing, and a dust mask.I owned clothing and had a pack of dust masks in a drawer.The only link is... ten days after the robbery, when I was fool enough to talk to the police, and they badgered my roommate into giving them enough for a search warrant... a $10 was in my wallet that matched one (of four) pieces of bait money stolen.<br><br>I was accused of literally every unsolved bank robbery for that year.4 of them, in Cedar Rapids, IA.<br><br>No evidence on the rest, except one had a robber in a similar jacket and mask.<br><br>And at the final deposition this week, it came out that the man who had accused me was a cop I knew.My uncle.Who had also lied when he was offering to be there for my family, and volunteered as a character witness... despite having ""anonymously"" added me to the list of white guys to be investigated.<br><br>I could understand if he thought he was doing his duty, but to lie to our faces about it... that's not integrity.When my lawyer called him about his supposed offer to be a character witness, he admitted it.And asked us to keep it from my mother.I think he's ashamed of what he did in the eyes of the family... so he can't have done this out of a sense of honor.<br><br>I am afraid.My life has been hell, full of panic attacks and constant stress.And right after finding out my own uncle... now we have a plea offer that will involve parole instead of jail.<strong>I feel <span style=""background-color:#2dfe5f"">manipulated</span> .</strong>I feel cheated.I feel betrayed.I'm not confident in anything.I don't know if my lawyer has just been soaking us for the hours.I don't like the ""evidence"" and I really don't like that nobody wants to use the FBI analysis.<br><br>And all that's without even knowing what the bill for all this is going to do to my family.For god's sake, the DA's office charges 50c a sheet for the photocopies of the documents they are legally required to share.I have over $300 worth of stuff that is of questionable relevance.<br><br>Thanks for reading this far.I just...I needed to vent, and I could really use some advice.<br><br>edit: Thanks very much, everyone.I'm quite stunned at how much of a response I've gotten.My replies aren't going to be as prompt for a while, as I need to lie down for a bit.Sleep's been suffering from the strain.<br>",manipulated,3.0,3.0,3.0
c9yz7m,"<strong>Why didn't I feel <span style=""background-color:#2dfe5f"">outraged</span>  as this was happening?</strong><br>","<em> Sexually assaulted by masseuse?</em><br><br>Was I sexually assaulted by my masseuse?I have so many thoughts and feelings, so thanks for understanding any poor grammar or anything in this rant.<br><br>&amp;#x200B;<br><br>Yesterday I went to an asian massage parlor that I've been to many times before.Usually, I do a cheap fully clothed reflexology massage, but yesterday I decided to treat myself to a full body 90 min massage.<br><br>I've gotten massages many times before and am very comfortable with getting my body touched and am ok with getting my butt massaged.<br><br>&amp;#x200B;<br><br>When I first arrived, they took me to a room where I quickly got undressed, everything except my underwear under the sheets.<br><br>I was wearing glasses that day, so I took those off too, so my vision was very impaired, which is fine because my eyes are closed the whole time.The man working started working on my neck shoulders, backs, buttocks and legs.He started to massage my butt over the sheets and I was fine with it.I've gotten massages before and they've massaged my butt in the past, so that didn't seem out of the ordinary.Everything seemed fine, except for when he was massaging my butt, my underwear was rubbing against my skin and it made me feel itchy.(This is where I fucked up).I told him that was happening and asked if I could remove my underwear.I kept the sheet over me the whole time and then we were back to normal.He continued the massage as normal and at the time, it felt mostly normal.Looking back, there are a few things that I thought were weird , but<br><br>I didn't feel crazy uncomfortable at the time.<br><br>&amp;#x200B;<br><br>I then rotated to massage the front side.He massaged my face and then the shoulders again.He then asked me if I wanted oil or lotion.I was like whatever you've been doing this whole time?<br><br>He covers my face with a towel and proceeds to start massaging my shoulders and then works his way down to my arms.<br><br>He massaging my legs and starts inching closer to my pubic area.This is when things start getting weird, I'm wondering if he's getting kind of close and at points, I'm honestly even slightly aroused, but I'm thinking, he's a professional, there's no way that this is happening and thought it was all in my head.<br><br>He kind of stops that area and then moves back to chest and removes the towel from my breasts to that I'm fully exposed.I'm alarmed, but just so shocked that this is happening to do anything.He moves back to my legs and sticks his fingers in my vagina.What the fuck is this really happening?Why am I not stopping him?What is going on?After a few seconds, I can't believe I took me this long, I motioned his arm away and use the towels to cover my chest.<br><br>He continues to massage my legs and then finally I just got the courage to tell him I need to stop and grab the towel, wrap it around my body, and ask him to leave.He just keeps pointing at something and saying something over and over and I'm not understanding, i just want to go.He then finally grabs a wet towel and says, towel for the oil.He tries to wrap it over and I'm just like no, I can do this myself.He quickly hands me a few more towels and leaves as I quickly dress and try get the fuck out of there.<br><br>&amp;#x200B;<br><br>As I leave, I told the front desk guy that I'm not paying for anything and that was unacceptable.I couldn't get the courage to tell him what happened and just left.<br><br>Moments later, I get to the car and I call him back and told him that the masseuse touched me inappropriately and that they need to do something about it.He apologized, but I was too pissed to see if that was even sincere.<br><br>I managed to call back later and asked for the masseuse's name and license number, they gave it to me, and then quickly hung up.<br><br>&amp;#x200B;<br><br>Since then, Ive been racking my brain about this whole situation.I feel so much shame and guilt.I feel like I let myself be in this situation.I should have stopped him when things were getting weird, but I didn't.Was I asking for this because I was slightly aroused?Not by him personally, but like someone is touching your leg?I have a boyfriend, how is this going to affect him?How is he going to be hurt to know this happened?I don't know.I know what everyone is going to say, but I can't help but just feel like it's my fault.I thought that if I was in a situation like this, I would know how to speak up.<strong>Why didn't I feel <span style=""background-color:#2dfe5f"">outraged</span>  as this was happening?</strong>I thought that I would know and feel extremely violated, but was I just in extreme shock?<br><br>I took off my underwear during the massage, that wasn't fucking smart.What the fuck was I thinking??I don't know what to do.I know everyone's going to say to file a report or whatever, but what happens after that?<br><br>Halp.<br>",outraged,3.0,3.0,3.0
17qgwdv,"<strong>I feel <span style=""background-color:#2dfe5f"">unnoticed</span> .</strong><br>","<em> I am a male 18, and I feel completely invisible to society.Especially by people my age.It makes me so angry everyday.The anger feels so overwhelming.I was never a violent person, but now I feel like other people are driving me to be violent.<strong>I feel <span style=""background-color:#2dfe5f"">unnoticed</span> .</strong></em><br><br>[removed]<br>",unnoticed,3.0,3.0,3.0
c23e8i,"<strong>I feel <span style=""background-color:#2dfe5f"">defeated</span> .</strong><br>","<em> My(28F) fiancée(30M) almost never initiates sex and it's affecting my attraction to him </em><br><br>I've had this issue with my fiancée for almost 4 years now (we've been together for 5).Our relationship is great, and he's everything I want in a partner, but this issue has made me call into question whether or not we're truly compatible.<br><br>I came to him with this issue 4 years ago and have continued to have conversations around it ever since.95% of the time I initiate sex, and I'm tired of being the driving force behind our sex life.I've done a lot to spice up our life in the bedroom, and he enjoys everything.Our sex is good, and he has no libido problems (to my knowledge), maybe his libido is not as strong as mine, but I don't believe he doesn't initiate because he isn't interested in sex.Problem is, because of our lack of sex my libido has gone down considerably.We have sex maybe twice a month, and it's solely because I've taken the initiative.I've become disinterested in having sex with him because I feel awful about myself, and our relationship.<br><br>I've had conversations on this repeatedly with him, and usually things improve for a little while.After our last conversation things didn't improve at all.He wants to try and says he will, but his actions don't reflect that at all.To me it seems that he's content to almost never have sex, at least he's never brought up his concerns around this issue before.I honestly feel like I don't know his real thoughts on this problem.He's said that he's worried about rejection if he initiates but that is just ridiculous - I told him in our last conversation that I've always welcomed it, and that I actually want it!He acknowledged that his rationale makes no sense.I really don't understand why he'd be intimidated by me, we've been together for a long time now.<br><br>I'm starting to lose my attraction to him and that feels the worst.I'm afraid that telling him this won't solve anything and will only make the problem worse.I just can marry him if our sex life is going to be like this, and I've maxxed out my ability to put effort into this.<strong>I feel <span style=""background-color:#2dfe5f"">defeated</span> .</strong><br><br>Is this something I should end the relationship over?Would couples therapy tackle this problem in a constructive way?<br>",defeated,3.0,3.0,3.0
13lbwzs,"<strong>I feel <span style=""background-color:#2dfe5f"">judged</span>  in a way that I don't when it's just one person, almost like I'm being ganged up on?</strong><br>","<em> How can I get better at talking to groups?</em><br><br>As my social anxiety has improved and I've started to feel more confident talking to people I've noticed the one area I still really struggle with is talking to groups or talking to people within groups.I find myself shutting down and becoming very intimidated, especially when I'm on my own and it feels like everyone else knows each other.<strong>I feel <span style=""background-color:#2dfe5f"">judged</span>  in a way that I don't when it's just one person, almost like I'm being ganged up on?</strong>Maybe this stems from childhood but I find groups to be my Achilles heel.<br><br>For example, my friend told me about a gig happening the other day that she thought would be a good place for me to meet new people (especially since I'm a musician) and I went along (by myself) but I never actually went inside.I saw the huge crowd hanging out outside the venue and I felt so small and unworthy, like all of my insecurities rushed in all at once.I just ended up walking around the area and going home.I felt so weak and dejected.<br><br>I really want to get better at this since it's holding me back a lot.Any advice is much appreciated :)<br>",judged,3.0,3.0,3.0
144m00u,"<strong>I don't feel <span style=""background-color:#2dfe5f"">noticed</span>  or he even loves me.</strong><br>","<em> Feeling invisible </em><br><br>I feel like I'm invisible.No little gift or hours spent<br><br>everyday playing with my three year old are nearly as good as what daddy or the grandparents or Aunt do.He'll talk about some small toy or couple of hours they spent with him for days.They leave and he'll talk all week about them.But he doesn't notice when I try to do something for him or will even throw a tantrum if I suggest going for a walk.Like I'm here to maintain him and the house but I can try to get him to do something like make muffins for days but he doesn't want to.I take him to the park it's whatever, they do it's a big deal.<br><br>I don't even feel like trying anymore.<strong>I don't feel <span style=""background-color:#2dfe5f"">noticed</span>  or he even loves me.</strong>I get all the tantrums, being the bad guy and poopy butts but they get all the love.I feel horrible for feeling this way but I do.<br>",noticed,3.0,3.0,3.0
y5i1it,"<strong>Just typing this out I feel <span style=""background-color:#2dfe5f"">furious</span>  all over again.</strong><br>","<em> Need validation for this messed up thing my nmom did </em><br><br>I never told anyone about this.But I think it's time that I do.<br><br>When I was 21, I finished my first year of university and moved back home for the summer.I made plans to go visit this guy I'd met a couple years before, not at uni but during a trip to Europe.I'm in Canada, he lives in the US.<br><br>Anyway, I got my plane ticket and all of that.Living at home, I didn't have much choice but to tell my parents where I was going.My mother kept asking me where I was going to sleep.Me being 21, I thought this was none of her business and just kept saying ""I don't know"" until she stopped asking.<br><br>Before I left for my trip, we had a family event.My grandma, aunt and uncle on my mom's side came to see us.One of the days they were there, I went to the kitchen to get something.My mother, aunt, and grandma were in the living room.My mother was talking about me and my trip, and whether or not she thought I was going to sleep with the guy.<br><br>I came out of the kitchen, said to her ""I can hear you talking, you know.""Then I sat down with them and started reading the newspaper.Dead silence.No apology, no explanation.I don't even remember what happened next.I just remember feeling angry.<br><br>I did that because I didn't want them to be able to keep talking about me.I figured, if they have something to say about me, they can say it in front me.No way was I going to leave the room and leave them to their conversation.<br><br><strong>Just typing this out I feel <span style=""background-color:#2dfe5f"">furious</span>  all over again.</strong>I was 21, a legal adult.I wasn't going to be doing anything in her home.I paid for the ticket myself.My sex life wasn't (and still isn't) any of her business.She's like a jealous teenage girl gossiping about the other girls at school.Unbelievable.<br><br>I don't think I can ever forgive her for that.<br>",furious,3.0,3.0,3.0
2oly9i,"<strong>Not a day goes by that I don't feel <span style=""background-color:#2dfe5f"">ridden</span>  with emotions.</strong><br>","<em> What medications could help to alleviate BPD symptoms?</em><br><br>I have a minor case of BPD, or at least it is beginning to be that way.As someone who is mentally ill, I'm doing fairly well for myself: I've been completely sober for 2 years, I'm in a committed relationship with a great guy, and I'm creating a career for myself at the young age of 20.I do not self-harm by cutting or burning myself; the worst I do is verbally abuse myself and my partner, as well as idealize suicide (it is an ""option"" to me).<br><br>While my symptoms may be minor compared to other people's, the times when my disorder takes over and I get angry can be quite scary.My boyfriend has feared for both my life and his own when I am dysregulating.Thankfully, these severe episodes only happen a few times a month (as opposed to daily or having it 3-4 times a week).However, not a day goes by that I do not feel mass amounts of stress about everything.<strong>Not a day goes by that I don't feel <span style=""background-color:#2dfe5f"">ridden</span>  with emotions.</strong><br><br>I haven't been on medication for a couple years.2 years ago I was on a high dosage of Seroquel, prescribed for my misdiagnose of Bipolar 2 Disorder.I went off of it because it didn't really help with my depressive or irritable moods, though looking back I may have experienced less psychotic episodes.This was also when I stopped using illegal street drugs and drinking alcohol, so weening myself off of all medication seemed like the right thing to do at the time.<br><br>I was diagnosed with BPD a year ago and had visited a psychologist monthly.After about a year of therapy (and learning DBT), he let me go because he thought he saw a great improvement in me and had nothing more to teach me.I did not truly feel that I was ready but trusted his judgement.And now, my boyfriend and I are both toying with the idea that I need to see a psychologist again and perhaps try using medication again for help ease some of my problems related to the disorder.<br><br>Please tell me your thoughts on the matter.Thank you so much.<br>",ridden,2.0,2.0,2.0
hpgnb2,"<strong>I feel <span style=""background-color:#2dfe5f"">stunted</span>  in growth.</strong><br>","<em> I feel like I am a confident, courageous, adventurous, and decisive person &amp; ambitious woman.I’m not sure if I can be with indecisive and not so confident people anymore.<strong>I feel <span style=""background-color:#2dfe5f"">stunted</span>  in growth.</strong><span class='emoji-bytes' data-emoji-bytes='[240, 159, 152, 162]'></span> I feel like I cannot grow into the person I want to be.<span class='emoji-bytes' data-emoji-bytes='[240, 159, 152, 173]'></span><span class='emoji-bytes' data-emoji-bytes='[240, 159, 152, 173]'></span> </em><br><br>[deleted]<br>",stunted,3.0,3.0,3.0
6o9vxh,"<strong>I feel <span style=""background-color:#2dfe5f"">deep</span>  shame.</strong><br>","<em> I always pick the wrong card from Curious Glimmerroot.</em><br><br>Am I the only one?<br><br>Probably, but I'll share my story anyway.<br><br>When I play the Root, three cards appear on my screen.<br><br>For some reason, my mind switches into ""discover a card"" mode.<br><br>For example, I'm playing against Jade Druid.<br><br>Curious Glimmerroot comes down on turn 3.<br><br>The three cards presented: Jade Idol, Shellshifter, Cenarius.<br><br>Sweet, Cenarius!Late game value!*click*.<br><br>...<br><br>I have selected the wrong card.<br><br>Malfurion, undoubtedly, finds this sequence of events ""spectacular"".<br><br><strong>I feel <span style=""background-color:#2dfe5f"">deep</span>  shame.</strong><br><br>Proceed to the concede/cry/drink alcohol sequence.<br><br>Am I the only one?<br><br><br>",deep,3.0,3.0,3.0
