id,short_context,full_context,emo_term,affect_score,affect_score_a,affect_score_b
18okx30,"<strong>I feel <span style=""background-color:#2dfe5f"">embarrassed</span>  when I think back on it.</strong><br>","<em> I'm a girl and I paid for a male prostitute </em><br><br><strong>I feel <span style=""background-color:#2dfe5f"">embarrassed</span>  when I think back on it.</strong>It's super weird for girls to pay for sex, and I feel like such a loser when I think that I actually did that.It's something I can never take back.<br><br>I did it when I was still living in Taiwan, and I saw a guy I liked on a male escort website.I liked his body and he had a really huge dick, something which I might never get the chance to experience otherwise.My friend kept pushing me to do it...so I did it.I did really enjoy the experience but....I just feel gross that I did it tbh<br>",embarrassed,3.0,3.0,3.0
6lykxb,"<strong>I feel <span style=""background-color:#2dfe5f"">confused</span> , and weird, and confused, and I'm sick of forcing myself to believe something I don't want to.</strong><br>","<em> Hi, sorry if this has been said/asked before (NSFW-maybe?).</em><br><br>So.<strong>I feel <span style=""background-color:#2dfe5f"">confused</span> , and weird, and confused, and I'm sick of forcing myself to believe something I don't want to.</strong>I'm a 20 year old male, who's always felt sort of girly, but always pushed the feeling away thinking that no one in my family or group of friends would accept me if I showed those feelings.<br><br>Whenever I'm browsing social media, and see girls, my first reaction is usually ""I wish I had __ like her"".<br><br>This feeling usually arises when I'm on instagram, and see models, or just friends post pictures.Usually just starts with wanting to have the same cute outfit as them, then the long hair, cute lipstick, and the one thing I've really been wanting, breasts.<br><br>I've always wanted to have breasts.<br><br>As for the NSFW part, sorry if I' not allowed to talk about these kinds of things here, but for the past few months, but whenever I'm watching porn, I'm wishing that I could be the girl, and hoping that some day a guy could penetrate me like that.<br><br>Please help me out?I'm really really mentally tired.<br>",confused,3.0,3.0,3.0
10gjvlg,"<strong><em> I'm feeling <span style=""background-color:#2dfe5f"">exuberant</span>  for you <span class='emoji-bytes' data-emoji-bytes='[240, 159, 140, 186]'></span> </em></strong><br>","<strong><em> I'm feeling <span style=""background-color:#2dfe5f"">exuberant</span>  for you <span class='emoji-bytes' data-emoji-bytes='[240, 159, 140, 186]'></span> </em></strong><br><br><br>",exuberant,3.0,3.0,3.0
ucjdb4,"<strong><em> Why do I feel <span style=""background-color:#2dfe5f"">clueless</span>  or better How do I stop being clueless?</strong><br>","<strong><em> Why do I feel <span style=""background-color:#2dfe5f"">clueless</span>  or better How do I stop being clueless?</strong></em><br><br>[deleted]<br>",clueless,3.0,3.0,3.0
ln6myl,"<strong>I feel <span style=""background-color:#2dfe5f"">agitated</span>  for no reason!</strong><br>","<em> I feel like shit right now.</em><br><br>My muscles are so achey and sore.No fever.I have a headache, and my throat feels so tight and my teeth are sore from always clenching my jaw.<strong>I feel <span style=""background-color:#2dfe5f"">agitated</span>  for no reason!</strong>And my brain is being so mean to me as well.I’m so overwhelmed with college.I just feel like not existing for awhile.Or just spacing out.I don’t know.I just feel like I need a break.I just feel so angry and anxious.<br>",agitated,3.0,3.0,3.0
177jcds,"<strong><em> today i looked in the mirror and thought “i feel <span style=""background-color:#2dfe5f"">handsome</span> ” for the first time </em></strong><br>","<strong><em> today i looked in the mirror and thought “i feel <span style=""background-color:#2dfe5f"">handsome</span> ” for the first time </em></strong><br><br>i have identified as non binary for a few years now.i always felt queer but couldn’t figure out how.i came to realize that what i was feeling was dysphoria.i got top surgery earlier this year, and it helped a lot, but i still hate my body.i hate being perceived as feminine.i’m curvy, no matter how much i try to hide it i just can’t.for a long time i have been wondering if i am actually a man and haven’t fully realized yet.i have trouble seeing this because i’ve only ever been raised as a girl.i have OCD so i tend to overly fixate on things like this, and it’s hard to tell what’s right and what’s not in my brain sometimes.<br><br>i got a shower today after dyeing my hair, dried my hair off, and looked in the mirror.i caught a glimpse of a boy.it was so clear to me.i’ve never been able to see myself that way.it made my heart flutter and skip a few beats and i cried a little (a good cry).i felt…handsome.i’ve never felt that before.it felt like a big feeling.<br><br>my friend wanted to see how my hair came out so i sent them a couple photos.they told me i looked handsome!!they are also transmasc, so i explained the feeling that i had to them.i told them i saw someone handsome in the mirror for the first time and i thought it was interesting how they saw the same thing too, only minutes after i experienced this.no one ever calls me handsome.it made me really emotional, and i’m still pretty confused about everything but i feel like this was Something.idk<br><br>wondering if anyone else has felt similarly and what it was like for you.❤️<br>",handsome,3.0,3.0,3.0
800lku,"<strong>And I feel <span style=""background-color:#2dfe5f"">humiliated</span>  that she needs to sustain me via her retirement salary, even though she doesn't have conditions and keep asking my mother for money.</strong><br>","<em> 23 years old.Being a couch potato, and don't want to work.</em><br><br>I stopped working for nearly 4 months.My last job was in a night club, which was extremely disgusting workspace.But that is for another story time.Let's begin with several problems that I have with life:<br><br>* I tend to lie a lot.Sometimes, I myself belief on my own lies.I lied to people that I had relationship, got accepted to university, got a scholarship and so on...I would lie anything to get away with it.The truth is, never been in relationship, my GPA is around 2, I don't think I can apply into any universities.However I never<br><br>ever asked additional information.<br><br>* I don't work, because I am embarrassed.Coming from medium-high class family, they simply kick me out of the house after the age 17.Barely had enough sleep since I needed to work full time at night and study at day.However, when I came back to my home country, I simply don't want to apply job, due to my ethnicity.I feel like that people are going to be racist against me at my home country.<br><br>* I want to work what I want.I want to find job, what I enjoy doing.I applied several companies in three different countries that I am eligible working full-time with no restriction.I got ZERO response.Some companies I applied two or three times, and still no response.I am trying to apply for Fullstack Developer.<br><br>* I am pretty much wasting my time.In my home country, I need to have a transcript to apply for university.The school that I used to go, have deleted my records from the database.As they say they keep student records for 5 years.So i don't even know how to apply university at my home country.<br><br>I am not satisfied with my lifestyle.Every single day have no meaning whatsoever, and I made no goals whatsoever on how to improve my life.And even if I want to improve my life, I need some sort of finance to start.My mother gave me all her saving from retirement so that I can start a new life, however I feel extremely unmotivated.She reccomended me in getting a coach and try to sort your life out, because NOBODY will do it for you.<br><br>Previously I was working at restaurants but I stopped because it was draining a lot of energy and I had really unhealthy life balance.Working for 10-12 hours, a total of 220-260 hours a month.I am not too sure what to do now.But I've been leaching at my grandparents place for 3 months already.<strong>And I feel <span style=""background-color:#2dfe5f"">humiliated</span>  that she needs to sustain me via her retirement salary, even though she doesn't have conditions and keep asking my mother for money.</strong><br>",humiliated,3.0,3.0,3.0
abzcsm,"<strong>I feel <span style=""background-color:#2dfe5f"">disappointed</span>  with myself that I did not report him to the police or have a pepper spray or a taser at hand.</strong><br>","<em> Sexually harassed and I attacked the harasser and I was told I overreacted </em><br><br>This just happened on a New Year's Eve Celebration somewhere in Europe.I was with my aunt who migrated to Europe for a long time.The crowd was jampacked like sardines and I was watching netflix on my phone while waiting for the fireworks display.I felt someone touching my butt, knees, and waist but I thought at first that it was accidental.It was really crowded.When I want to inspect if I'm just imagining things and turned off my phone, the touching stopped.Then suddenly, the guy (he's at my back) whispered to me that I look nice.Since I'm Asian, I pretended not to know English (but stupid me, he's taller than me and can definitely see I'm watching a series with english subtitles).I don't want to cause a scene or leave the place because my aunt wants to watch the fireworks display.I tried my best to evade the guy for 30 mins in the small space but he kept on doing it.I was so afraid but I don't want to just let that person off the hook.So while holding my phone, I elbowed him and use my 2 hands and phone to pummel his chest and I kept yelling pervert.My aunt tried to defend me and asked me what's wrong I told her about the guy touching my butt (I was on the verge of crying but there were no tears) and the guy and his group of friends were laughing at me.I also saw a woman shaking her head at me like I was wrong to attack the guy.Thank goodness, some guys just made a border between me and the group of perverts.Then, 2 Koreans asked me if I'm all right, my aunt told them that I'm okay and it happens a lot in Europe and even worse things happen to other women in Europe.I feel so conflicted because I tried to just ignore the guy but he won't stop.But I can't help myself to retaliate, to defend myself.<strong>I feel <span style=""background-color:#2dfe5f"">disappointed</span>  with myself that I did not report him to the police or have a pepper spray or a taser at hand.</strong><br><br>Is it true that sexual harassment happens often in Europe and I just overreacted to this ""normal circumstance""?<br>",disappointed,3.0,3.0,3.0
ajv8xu,"<strong>Zoloft had no effect on me and Lexapro has made me feel <span style=""background-color:#2dfe5f"">emotional</span> ly ""flat"".</strong><br>","<em> Switching from Lexapro to Effexor.Will my energy/motivation increase?How does it effect sleep?</em><br><br>I'm a 22 year old male who's had Major Depression/Generalized Anxiety Disorder for six years.I've been on Zoloft, Lexapro, Lexapro/Seroquel combo and I'm currently on 15mg Lexapro/1 mg Risperdal combo.<strong>Zoloft had no effect on me and Lexapro has made me feel <span style=""background-color:#2dfe5f"">emotional</span> ly ""flat"".</strong>I don't feel emotional lows or highs since I've started on it.I hate feeling so dead inside so I asked my new psychiatrist if I could change medications.<br><br>The biggest symptom of my depression is lack of energy and motivation.I feel tired constantly, even when I get a good night's sleep (which is rare).I have very little interest in daily living and absolutely no motivation to make any big changes in my life.I used to have friends and hobbies but I haven't been interested in them in years thanks to my depression.<br><br>Based on this info my new doctor recommended Effexor.He said it was an ""activating"" antidepressant that won't make me feel emotionally flat.He was concerned that it would make my insomnia even worse but prescribed it anyway.I'm going to take 75 mg for a week, then 150 mg.<br><br>I have a few questions for those who take this drug:<br><br>* Has your energy increased since you started effexor?Do you feel less tired?<br><br>* Has your motivation gotten better?<br><br>* Has Effexor interfered with your sleep?<br><br>* Any serious side effects you've experienced?<br><br>Any other comments/tips/experiences would be appreciated.<br><br>Edit: thanks to everyone who responded.<br>",emotional,0.0,0.0,0.0
277xn8,"<strong>I feel <span style=""background-color:#2dfe5f"">pathetic</span>  and I can't even eat tonight.</strong><br>","<em> Can't eat tonight, can't get to work, why bother anymore </em><br><br>I don't know what to do anymore.I have no money, my car broke down so I can't get to work, my rent is eating away all my money, and I'm single and lonely.No friends to talk to, nothing to do during the day except work.I have anxiety and my car being broken down is killing me because I know<br><br>can't get to work tomorrow or the next day or the next day and I don't have the money to fix it.I don't even have money to eat tonight, or the next.My parents both shut me out and moved to Vermont, so I couldn't ask them for help if I tried.There are no soup kitchens around here or anything, I'm practically homeless.I haven't eaten in 25 hours and I'm just trying to find a reason to live anymore.I'm gonna get fired from my shitty job and be out on the streets in no time.My life is shit.There's no love in it.<strong>I feel <span style=""background-color:#2dfe5f"">pathetic</span>  and I can't even eat tonight.</strong>I'll be dead from starvation before anything.I need money and money is what I'm out of, and it seems like I'm out of time too.I haven't felt this sad in a long long time.<br>",pathetic,3.0,3.0,3.0
7afx25,"<strong>I do not feel <span style=""background-color:#2dfe5f"">aggressive</span> , suicidal or in any way motivated to pursue even a conversation with anyone involved ( I do recognize those involved make unwanted contact and may hide their identity here and elsewhere)</strong><br>","<em> Recruitment and Radicalization in Organized Stalking </em><br><br>In terms of those who come here to provoke fear in targets, are their similarities to terrorism?For example, I have had people write to me on reddit to get a gun to protect myself during times that there have been intense provocation to make me scared through varied harassment.<br><br>(Recently I had a woman mimicking my every move in a movie theater while I waited to buy tickets for my daughter and her friends.This was witnessed and one of the rare times I reacted verbally) So people are recruited to write here to invoke fear, to follow social media pages, create videos, participate in stalking/harassment and have the intention of intensifying an emotional reaction that may cause an individual to react in a way that is harmful to themselves or others.Can't we define this as terrorism in a way that can prosecute those involved?<br><br>EDIT: I am never going to buy ANY weapon or engage in any harmful act towards myself or others.<strong>I do not feel <span style=""background-color:#2dfe5f"">aggressive</span> , suicidal or in any way motivated to pursue even a conversation with anyone involved ( I do recognize those involved make unwanted contact and may hide their identity here and elsewhere)</strong><br><br>.<br>",aggressive,3.0,3.0,3.0
6ifr8z,"<strong>So I found a way to make 20/hr from home making my own hours and am super excited that I am able to bring in at least an extra grand each month, and plenty more if I'm feeling <span style=""background-color:#2dfe5f"">aggressive</span>  that month.</strong><br>","<em> The idea of a second job on top of my current full time job made me VERY uneasy, but was necessary to pay off debt.But I kinda struck gold here!Quick backstory and some tax questions.</em><br><br>I'm not going to break down my entire financial situation (it's not nearly as bad as it could be), but I've got 30K I want to pay off in 2 years and I make 45K/year.<br><br>After laying out a zero sum budget, I had $250 each month to put towards this debt (after minimum payments).<br><br>Was looking to be debt free in 4.5-5 years!<br><br>Ah!<br><br>That's a long time of buckling down and doing only free activities to keep myself sane.<br><br>A second job was pretty much necessary so that I can reach my financial goals sooner - Debt free, large retirement contributions, house.<br><br><strong>So I found a way to make 20/hr from home making my own hours and am super excited that I am able to bring in at least an extra grand each month, and plenty more if I'm feeling <span style=""background-color:#2dfe5f"">aggressive</span>  that month.</strong><br><br>The tricky part is that I'm hired as an independent contractor and will therefor have to handle all of the taxes myself.<br><br>Can anyone point me toward a breakdown of how I should be handling this?<br><br>I honestly don't have the first clue.<br><br><br>",aggressive,3.0,3.0,3.0
4ljfg5,"<strong>For the first time since my mom showed up, I don't feel <span style=""background-color:#2dfe5f"">nervous</span>  or scared.</strong><br>","<em> Update: Me [37 F] with my brother [20 M], he told my abusive mother where I was </em><br><br>Last post: [right here] (https://www.reddit.com/r/relationships/comments/4jeu1o/me_37_f_with_my_brother_20_m_he_told_my_abusive/)<br><br>Sorry for the late update.I wanted to get everything sorted out before I posted again.<br><br>I didn't quit my job.I went back, as embarrassed as I was.My brother wasn't there.My manager said he quit, but she couldn't go into much detail.I'm assuming he did so to avoid getting in trouble or something.Everyone pretended like nothing was wrong and treated me as they normally do.It feels weird to be back, but otherwise okay.<br><br>All the calls were from my brother.None from my mom, thankfully.I<br><br>don't think he gave her my number, or else she would have called by now.She didn't come over to my house either.Jay left a few voicemails apologizing profusely and crying, but I deleted them.I looked into a restraining order for my mom and I'm getting into the process of getting it done.It's more complicated and expensive than I thought, but I think it's going to be worth it.<br><br>Although many of the commenters from my last post would protest, I did reach out to my brother.I called him today and told him I wanted to talk.We met at a local cafe for lunch.I told him what he did was extremely disrespectful and that I had lost all trust in him.He cried, but he said he understood.We talked some more - not about mom or family or work.Just talk.I told him about the time I went half-way across the world to see a band, but had never went to some beach that was a couple hours away from my old apartment.He told me about the time he went to a movie theater and fell asleep during a particular movie.Then, we mostly sat in silence until I suggested that we go somewhere else.On my way to work, I pass by an expanse of flat land, with some hills in the distance.I've always wanted to watch the sunset from there, and I guessed that today would be a good enough day to try.<br><br>So we went and sat there until the sun went down.It was a beautiful sight - the kind you can't accurately depict in words, paint, or pictures.Then I told my brother something like, ""I don't want to be your best friend or part of your family.I just want to be *my name* and Jay.Just two people, with the same mom, and be happy with who we are.""<br><br>He nodded and said okay.I drove him back to his car.We said goodbye and I went home.<strong>For the first time since my mom showed up, I don't feel <span style=""background-color:#2dfe5f"">nervous</span>  or scared.</strong>I feel okay.I don't know if I really got through to Jay, but even if I didn't, at least I can say I tried.He's a good kid, but now he's got to decide whether to be a mommy's boy for the rest of his life or become truly independent.I can't make that decision for him.Maybe someday we'll be friends again, but right now we're just two people, connected by similar strands of DNA, who can watch the sky as the earth slowly rotates as it orbits the sun together in silence.I'm happy with just that.<br><br>**tl;dr**: Went back to work, cleaned up things with my brother sorta.Feel at peace.<br>",nervous,3.0,3.0,3.0
614abd,"<strong>And then I feel bad for getting them together, and I feel <span style=""background-color:#2dfe5f"">crushed</span> .</strong><br>","<em> Heartbroken when friends don't get along </em><br><br>I'm curious if any of you INFPs go through a similar thing with friends.I have a bad habit of getting excited when two or more people I like having the opportunity to meet each other.In my head, I imagine everyone becoming best friends, because I love person x and person y, so surely they will love each other.<br><br>In reality, people don't always get along.Sometimes, they really dislike each other for whatever reason.<strong>And then I feel bad for getting them together, and I feel <span style=""background-color:#2dfe5f"">crushed</span> .</strong>I don't know exactly why I take it so hard, but I do.<br><br>Anyone have similar experiences?How do you deal with it?<br>",crushed,3.0,3.0,3.0
98odib,"<strong>I feel <span style=""background-color:#2dfe5f"">irritable</span> , restless, anxious, my back and neck are aching badly and I frequently have headaches.</strong><br>","<em> Quitting all drugs, a paradox, I need some insight </em><br><br>Before I started experimenting with drugs I was a very miserable and closed-minded person, I hated most people and was completely lost in life, I blamed most of my problems on other people and harbored a lot of bitterness and resentment.<br><br>I had very little self worth and spend most of my time playing video games, masturbating, and being generally edgy.<br><br>The first time I smoked weed everything changed, I felt levels of love and appreciation for life I never thought I would be capable of feeling.<br><br>It might go with out saying that I rapidly became a pot head.<br><br>Later that same year I tried ecstasy for the first time, and it was even more trans-formative than weed.<br><br>My entire perception of the world had been shattered and ever since then, I have felt more loving and compassionate for both myself and others.<br><br>I later tried mushrooms which definitely also altered my perception of the world and left me with this very deep ""everything is going to be okay and everything is as it should be"" feeling.<br><br>My most recent discovery and consequential addiction has been DXM, the anti depressant properties are ridiculous, DXM seemed to transform all of my problems from mountains I had to climb into tiny ant hills, DXM improved my relationships by allowing me to be both high as a kite and also deeply introspective.<br><br>Here is the thing, after all these experiences, after seeing how truly beautiful life can be, deep down I want to be sober now, I want a family of my own, I want to create things and live life to the fullest, and I dont want to hurt my loved ones any more.<br><br>Its like without drugs I had little appreciation for life but they allowed me to open my eyes to everything, and now that I've opened my eyes, I realize that my very drug habits are something that are not constructive to my life.Yet at the same time, my very appreciation for life and my desire to finally ""do the right thing"" must be credited to beautiful experiences I have had with drugs, and now I just don't know what to do.<br><br>I am a week clean from all drugs today, and I start another semester of college tomorrow.<br><br><strong>I feel <span style=""background-color:#2dfe5f"">irritable</span> , restless, anxious, my back and neck are aching badly and I frequently have headaches.</strong><br><br>Every day and night I am fighting urges to use again, especially DXM.<br><br>Im just worried, I feel like I really fucked up, Ive been an addict for so long that I feel miserable when im using, and all the pleasure I get from the drugs just makes me long for experiencing a sober life and having its pleasures.<br><br>But im terrified, im terrified that without the drugs all this beauty in life I am able to perceive will simply slip from my view and I will fall right back into the shitty, angry person I was when I was sober before.<br><br>Im miserable in withdraws right now and I know going back to drugs will make me miserable, but right now it just feels like sober living will be miserable too, it certainly was before I had drugs in my life.<br><br>Any insight would be appreciated, I dont know what to do<br>",irritable,3.0,3.0,3.0
cv5jf6,"<strong><em> Two heroin questions: I feel <span style=""background-color:#2dfe5f"">irritable</span> , why?</strong><br>","<strong><em> Two heroin questions: I feel <span style=""background-color:#2dfe5f"">irritable</span> , why?</strong>Does crushing it in my wallet less effective?</em><br><br>[deleted]<br>",irritable,3.0,3.0,3.0
