id,input,labels,t5_trg
fulg_sha1:ET4AF7B,"Cor bărbătesc MoiseiBöszörményi Leventeînregistrare & procesare sunet (volumele 1, 2 și 3) Îmi amintesc că în urmă cu șase ani şi jumătate am fost întrebat de către dirijorul corului, Cristi Coman dacă aş putea să mă implic în ""facerea"" primului album. Sincer, mi se părea complicat: mulţi oameni, stres prea mult, etc. Acum, când mă uit la ce a ieşit, la cât de mult s-a unit acest cor, reuşind să producem 3 albume împreună, mă simt [MASK], ştiind că am pus umărul la sudarea unui sunet unic, complet şi cu tendinţe perfecţioniste - Corul Bărbătesc Moisei. Iată-ne ajunși mai departe decât am crezut, la albumul 3, aproximativ în aceeași formulă. Cel mai îmbucurător lucru este continuitatea corului și perseverența membrilor lui.",['împlinit'],[MASK] împlinit
filmot_Z2IsP3AOLUo_640.7,"eram foarte [MASK], foarte simțeam că toată lumea dă în mine și mă simțeam atacată.",['tensionată'],[MASK] tensionată
fulg_sha1:SFYDVAZ,"...laca de baza Prima intrebare pe care o pot argumenta este de ce am ales aceasta tema ""Drivere pentru placa de baza:"" , de ce tocmai aceasta ? Orcine are pe birou un calculator, dar oare oricine poate spune din ce este compus, ce este in acea carcasa de metal, cum fuctioneaza toate acestea ? Nici eu nu stiam, dar purtam aceste intrebari cu mine atunci cand ma asezam in fata calculatorului, eram [MASK] de tehnologia, ""magia"" care se petrece in fata mea zi de zi , asa ca am decis sa aflu ce se petrece in aceea carcasa metalica, dar la deschiderea ei am deschis portile unui taram necunoscut, nu stiam ce sunt aceele placi imbinate precum un pazal, ce aratau ca niste orase mari privite din satelit. Alte referate despre: drivere pentru placa de baza, drivere pentru placa d baza, cauta referatinstalare placa de baza si drivere Referate afisate : 17 Medie note: 8.36 / 10 Referate: Administratie Agronomie Arte plastice Astronomie Automatica Biologie Chimie Comert Comunicare Contabilitate ...",['fascinat'],[MASK] fascinat
filmot_iUMB7kombzQ_7701.8,Niciunul din partenerii tă am [MASK] repet butonul este acolo dar nu sunt genul ăla. Gen dacă mi spui vieți cu băieții și eu să te sun într una. Deci probabil. Eti mai realistă și te duci.,['gelozie'],[MASK] gelozie
fulg_sha1:4DYULEG,"Însă, este cert că ei și-au recuperat-o, ca să nu spun altfel, după ce a fost numită, iar acum au extras-o frumos și au pus-o la păstrare la Bruxelles"" https://www.bugetul.ro/traian-basescu-provoaca-un-cutremur-pentru-cine-a-lucrat-in-realitate-kovesi-acum-au-extras-o/ Daniel spune: Poate mă lămurește careva referitor la citatul acesta a lui Klaus Johannis: ""că, prin acest muzeu, România apără istoria, moștenirea și cultura celor care au contribuit la devenirea națiunii române."" Sunt puțin… Nu înțeleg?! Ce vrea să spună mai exact, că România este un stat ce a devenit națiune datorită jidanilor /jidovilor și nu a eroilor neamului care au s-au sacrificat pentru noi și neamul nostru? Sunt [MASK] sau nu înțeleg eu, și vorbește Klaus Johannis pe mai multe limbi (înțelesuri). Sănătate și mântuire! Doamne Ajută!",['stupefiat'],[MASK] stupefiat
filmot_2Kff-1L8TkY_7402.4,în metrou să plec la muncă dimineața era chin. Deci preferam să merg pe jos coaie ești nebun să iau. Băi era deci în metr îmi era [MASK]. Deci o anxietate coaie de dacă stăteam acolo când mergeam cu metrou mă luau bosele și că am fost la sapă coaie toată ziua.,['chin'],[MASK] chin
fulg_sha1:LJEAG3A,"Problema cu auto-perfecţionarea este de a ştii când să renunţi. Adăugat de Veronica Şerbănoiu Este disponibil şi textul în engleză. Nu sunt [MASK]. Îngâmfarea este un defect, iar eu nu am defecte. Adăugat de Cornelia Georgescu Banii nu pot cumpăra fericirea, dar pot cumpara un yacht imens cu care să navighezi aproape de ea.",['îngâmfat'],[MASK] îngâmfat
fulg_sha1:NSL5B65,"Cristi Dobrei | Vorbe de duh | Tematica: Veghere Când îţi râde lupul în faţã, înseamnã cã mai are câţiva prieteni ascunşi. Cristi Dobrei | Vorbe de duh | Tematica: Lupte spirituale Cind oamenii nu cred ca vei reusi... Dumnezeu spune: Eu am [MASK] in tine! Argentina | fara album | Tematica: Diverse Cautarea Celui Vesnic te va duce in vesnicie, pe cind regasirea in lucrurile pamantesti te vor duce la pieire! Argentina | Vesnicie | Tematica: Vesnicia Cauta sa fii apreciat de Dumnezeu mai mult decit de oameni...",['Incredere'],[MASK] Incredere
fulg_sha1:NZQ6V52,"...ru Elena Udrea, aduşi într-o geantă la minister Editoriale VoxPublica România, cum ar fi putut fi Cristian Teodorescu 02 mar, 20:17 ""Singur acasă"" – varianta naţională Daniel Oanta România – cu ochii pe voi din oficiu. Ipocriziile Comisiei Europene Costi Rogozanu Emisiunile zilei Program 07:00 cu Aneta Sângeorzan şi Dorin Chioţea 11:00 REALITATEA DE LA 11:00 cu Eli Roman Vremea Toate orasele Editoriale Pandoras Sigur că mi-e [MASK] după documentarul englezilor despre români – mi-e rușine de rușinea rușinaților Dora Constantinovici 24 feb, 15:13 Premiată cu OSCAR pentru cel mai bun rol secundar – Patricia Arquette cere drepturi salariale egale pentru femei Pandora Strânge la plecare mâna care ți-a fost întinsă la sosire MirelaRetegan Tabu.ro Concurs: Femei Memorabile! Fecioara (24.08 - 23.09) Peste halibut pe pat de salata verde Fanatik.ro STEAUA. Pe Guilherme îl aşteaptă IADUL la Ploieşti!",['rușine'],[MASK] rușine
fulg_sha1:C4UQIMA,"A revenit acea amorţeală asupra mea, acea amorţeală care-mi spune: încă n-a ajuns cel predestinat. Să ştii că nu mă mai grăbesc. Am început să văd iar tot ce e în jurul meu, şi din nou sunt [MASK] de această lume. Totul e atât de spălăcit şi toţi încearcă să văruiască în culori mai vii viaţa, dar nu le iese aproape niciodată. Eu nu mă mai opresc nici să mă uit, nici să ascult...Văd doar ce trece în grabă pe lângă mine şi totul e la fel de monoton.",['fascinată'],[MASK] fascinată
filmot_J4cl1_MWIbQ_11954.1,Urăsc să dorm. Voi ați pomenit om care urăște să doarmă nu dorm nu coaie nu mă simt [MASK] când dormi și nimeni nu mă înțelege frate nimeni nu mă înțelege coaie eu nimeni din jurul meu nu mă înțelege că eu s.,['bine'],[MASK] bine
fulg_sha1:FEPJ4MA,"Am încredere! Viața mă iubește! Simt [MASK] pentru tot ce am trăit. Simt recunoștință pentru tot ce am și, mai ales, Simt recunoștință pentru tot ce sunt și aleg să devin. Am încredere!",['recunoștință'],[MASK] recunoștință
fulg_sha1:QMNP24K,"3- La Multi Ani! (Joi, 7 aprilie 2011, 15:38) Tymax [utilizator] si sanatate lui Torvalds ... trimis de pe Arch Linux la multi ani linux (Joi, 7 aprilie 2011, 15:51) nume [anonim] un sistem extraordinar si sunt [MASK] ca m-am jucay cu el .. e adevarat ca e cam complicat dar merita, acum sunt cu 2 sisteme. Parerea mea este ca totusi incearca sa faca din masina de razoi o masina de oras confortabila, cu Windows ai confort dar cu Linux mergi in zone unde Windows-ul nici nu prea viseaza.",['bucuros'],[MASK] bucuros
filmot_HvJnYgerUzE_443.9,Mi am găsit jumătatea numele tău. Moș Crăciun videoclip pe numele tău mă simt [MASK] numele tău vreau să fiu pe numele tău mă treci noaptea târziu pe limba ta vreau mereu să fiu când.,['fericită'],[MASK] fericită
fulg_sha1:W7SB4MQ,"Prima dintre noi care a avut de suferit a fost chiar mama mea, Elena. Aveam 25 de ani cand saraca a venit acasa plangand in hohote. A intrat pe usa, ne-a aratat, mie si surorii mele, Irina, geanta si, printre hohote, ne-a spus: - Sunt [MASK]! Mi-au taiat hotii geanta in autobuz! Mi-au luat portofelul, in care aveam banii, actele si cheile...",['nenorocita'],[MASK] nenorocita
fulg_sha1:AS2GO2F,"Serialul mi-a adus multa expunere si, in acelasi timp, m-a ajutat sa acumulez experienta. N-as fi ajuns atat de repede aici fara el. Sunt [MASK] ca imi pot desfasura in perfecta armonie atat cariera solo, cat si cariera alaturi de LaLa Band si Pariu cu viata. T.: Cum privesc ceilalti colegi din LaLa Band succesul tau solo? Ai simtit vreodata vreo urma de gelozie din partea lor?",['fericita'],[MASK] fericita
fulg_sha1:R3BCMVW,"N-ai de unde să le mai ceri birurile înapoi. Amu am biruit noi. 🙂 "" Nu mi-e [MASK] nici cu bărbații ascunși pe sub mese, deconspirați mai recent ca la banca acuzaților: în rate și rateuri. Așa a fost să fie creditul: neperformant. Cum ce va urma?",['rușine'],[MASK] rușine
fulg_sha1:ZEYD6WD,"Mai multe informații despre politica de retur găsești aici Scrie un review Review-ul a fost trimis cu succes. Achizitie verificata Marina, Acum 8 luni Mi-a venit paltonul de câteva zile, am comandat un XS (am 1.53/53kg inainte de sarcina). Imi place ca e mic la umeri dar are si spatiu in dreptul burticii suficient cât să pot creste in voie pana la 9 luni, asa ca ma simt [MASK] in el, nu ca un copil intr-o haină oversized. Tot ce-am mai incercat parca pornea de la premiza ca daca esti insarcinata sigur sari 2-3 numere din start, dar in fapt iti creste doar burta nu și spatele :D. Are mânecile puțin cam lungi si largi, dar le port suflecate, oricum sunt exceptional de mică de înălțime și nu cred că am găsit până acum vreo haină care să-mi vină fix la mâneci.",['bine'],[MASK] bine
fulg_sha1:CHUAHCD,"De ce ne batem cu jandarmii ? [flickr]http://www.flickr.com/photos/7508086@N05/6731466587/[/flickr] Urmăresc cu interesc acţiunile de la Bucureşti şi sunt [MASK] de cum nişte animale de oameni, că altfel nu pot fi clasaţi, măcelăresc oameni doar pentru că aşa li s-a poruncit sau că aşa au hotărât ei. Că sunt şi protestatari care sunt violenţi şi intervenţia asupra lor se justifică nimic de comentat aici, dar cel mai tare mă deranjează când văd cum sunt bătuţi oameni nevinovaţi, oameni bătrâni sau tineri nevinovaţi care au venit în piaţă să îşi ceară drepturile. Cu ce drept dă un jandarm care probabil are 8 clase eventual liceul (profesionala) într-un student, om în vârstă sau oricine atcineva care are o pancardă sau strigă un mesaj pentru a fi auzit cu speranţa că el chiar face diferenţa ?",['scărbit'],[MASK] scărbit
reddit_roap_2180,"Unde pot strange bani fara sa am acces la ei? // Salutare,

Eu m26, am o problema cu lipsa de control cand vine vorba de bani, reusesc sa ma tin cumva de un buget, dar lunar dupa chirie, si cheltuieli (si niste fun money cam vreo 1000 de lei), imi ajung teoretic sa mai pun ""la saltea"" cam 20002500 de lei, problema e ca nu am reusit niciodata sa pastrez banii in contul de economii mai mult de 23 luni, ca ma ia pe mine cate o idee daia gen hai sami iau playstation, sau televizor sau nush ce porcarie de care nu am nevoie, pt ca ma ""ard banii in buzunar""; Intrebarea mea e: unde as putea sa pun banii deoparte, cat sa am acces la ei in cateva zile daca am nevoie dar sa nu fie un proces simplu, ca eu mai sunt si incredibil de lenes si decat sa ma duc la banca, si sa completez nush ce cerere mai bine ma lipsesc de gadgetulporcarioara pe care vreau sa o cumpar. Am reusit acum cativa ani sa strang niste bani cu un cont de investitii ceva de la bcr, si atunci a mers binisor pt ca puteam sa pun bani in contul respectiv de pe tel, din aplicatie, dar nu puteam sa ii scot decat cu cerere la sediul bancii, dar am ales sa inchid contul respectiv ca sunt cam [MASK], si cand sau adunat mai multi bani, daca scadea cu 1% simteam ca pierd, deci as evida pe moment conturi de investirii. Pare rau ca e postul lung dar mar ajuta foarte mult daca miati putea recomanda vreo solutie.

Multumesc,",['anxios'],[MASK] anxios
fulg_sha1:2HFY3TI,"duminica am primit de la nepotelele noastre Emma si Greta cate un buchetel de flori de camp. Am iesit cu ele la plimbare si cea mare, Emma, a cules cu migala peste 50 de banuti. Greta, care e ca o maimutica, o admira si o imita pe surioara ei mai mare, dupa ce a vazut ca eu am fost foarte [MASK] ca Emma mi-a daruit buchetelul, s-a hotarât sa imi faca si ea un buchetel... S-a repezit la Piciorul cocoșului ca e gata manunchi ☺☺☺ e mai greu de smuls ☺☺☺ dar din doua ruperi, ai gata buchetul ☺☺☺ Bineinteles ca m-am bucurat si de florile ei. Si le-am adus acasa (o ora de mers cu masina, din München la Augsburg) si le-am pus în vaza si inca sunt frumoase!",['încântata'],[MASK] încântata
fulg_sha1:5BKFW4M,"9 martie 2013, 11:53 Toţi ""existăm"" pentru că suntem înconjuraţi de ""ceva"", cauză-efect, numai că de cele mai multe ori nu vedem ""ceva-ul"" pentru că în loc de ochi avem: ""două puncte negre, pline ochi"" (...) Ochii sunt orbi. Cu inima trebuie sa cautam. 9 martie 2013, 23:10 sa stii ca si eu ma simt [MASK] cand sunt incojurata de frumos <3 De fapt, cred ca toti avem nevoie de sublim ! Tlaloc 10 martie 2013, 17:30 Incerc sa las un comentariu la acest post, nu pot. Parca as avea prea multe de spus, despre mister, simbol, despre origini.",['bine'],[MASK] bine
fulg_sha1:ELYMYR2,"...aterală/ Manivelă: Oţel, Strat anticoroziv (pudră epoxidică/poliesterică) Mâner: Plastic ABS Coadă: Oţel, Galvanizat Tub: Aluminiu Pentru întreținere nu trebuie să faceți nimic special, o cârpă ușor umezită (chiar și o cârpă normală de bumbac cu puțin pronto), șters bine iar în 30 de secunde este gata. Preț și livrare Am căutat mai multe variante de birouri, însă niciunul nu avea blatul așa alb și plăcut la atingere. Știam că produsele IKEA sunt altfel decât cele găsite local prin Timișoara, l-am cumpărat și îl folosesc de 3 luni de zile și sunt foarte [MASK] de el. Birou 120cm – preț actual 899 lei cu tva + transport până în casă cu alegerea intervalului orar; Birou 160cm – preț actual 999 lei cu tva + transport până în casă cu alegerea intervalului orar. După ce am făcut comanda online am așteptat cam 1 săptămână jumătate până când a sosit mașina IKEA cu coletul meu.",['mulțumit'],[MASK] mulțumit
filmot_ZitPhSJpKEs_196,"Da Uite așa țoc țoc și rămân cu ei în mână. Dacă nu cu o ață. Mă, mamă, mie, eu când eram micuț îmi era foarte frică să să mi scot dinții, gen care se hâțnau, care se mișcau. Da, oricum eram [MASK]. Eram fricos tare rău de tot. Bun.",['fricos'],[MASK] fricos
fulg_sha1:4BTLU6V,"Şi că am importat-o. Dar… putem să-i condamnăm pe copii că au ales un carnaval înainte de vacanţă?! Nu sunt [MASK] după materialele achiziţionate de-a gata, aşa că ne apucăm de confecţionat o podoabă din pene pentru un mic indian. Şi pentru că nu putem jumuli nicio zburătoare pe terasă, vom realiza penele din hârtie. Materiale necesare: hârtie divers colorată foarfecă lipici câteva coli albe, carioci Pentru început se pregăteşte banda pe care se vor prinde penele.",['înnebunită'],[MASK] înnebunită
rosent_7541,"excelent
am achizitionat anul trecut in iarna 2 bucati, le-am montat pe spate si sunt [MASK], silentioase, isi fac treaba bine!",['multumit'],[MASK] multumit
filmot_-jwyms-v2xc_2222,făcut lecțiile singură n am avut nicio problemă dar este și băiatul meu sunt prietene și unchiul meu care ne ajută foarte mult deci dar îmi este [MASK] de copiii mei și mi e dor de România Deci să știți că sunt în AV simt când sunt deasupra. României simțiți bun vine.,['dor'],[MASK] dor
fulg_sha1:LWWWR7W,"MI-A ÎNTINS CARNETUL DE STUDENT ŞI MI-A SPUS TĂIOS: VALEA! AM VRUT SĂ-I MULŢUMESC… M-A OPRIT SMUCIT: VALEA… AU FOST CELE MAI CRÂCENE ÎNJURĂTURI CARE MI-AU FOST ADRESATE ÎN VIAŢA MEA DAR, SINGURELE CU FOLOS… MULŢUMESC CĂ M-AI ÎNJURAT DOMNULE! AM VRUT SĂ-ŢI MULŢUMESC DE ATUNCI DAR, ERAM [MASK] DE SPERIATĂ. AM SCĂPAT DE DUBĂ ŞI N-A FOST PUŢIN LUCRU. AM PLECAT AMÂNDOUĂ CU GENUNCHII MOI, EU CU TORTUL, EA CU CASETA.",['ÎNGROZITOR'],[MASK] ÎNGROZITOR
filmot_txDntdJKny8_689.4,"Dar nu, nu am nevoie, chiar am nevoie să mă simt [MASK] pentru că nu sunt , înțelegi? Nu.",['fericită'],[MASK] fericită
fulg_sha1:KFXUR2H,"""Dacă vreţi, strict legal, este doar decizia Consiliului de Administraţie. Conform Ordonanţei 109, autoritatea tutelară nu are atribuţii în stabilirea managerului sau în stabilirea activităţii şi rezultatelor managerului, ci doar în analiza globală a activităţii întregului Consiliu de Administrație. De aceea, dacă se întâmplă ceva la TAROM în neregulă şi eu nu sunt [MASK], ar trebui să dau afară tot Consiliul de Administraţie, ceea ce ne duce şi la ideea că cei din CA pot să hotărască în ce mod îşi organizează managementul companiei pentru ca aceasta să aibă rezultate bune"", a susținut Relu Fenechiu. De asemenea, ministrul a precizat că el l-a propus și pe Demetriade director executiv al TAROM. ""Demetriade a fost selectat din prima listă de către consultanţi.",['mulţumit'],[MASK] mulţumit
fulg_sha1:TIJQPQU,"Oamenii trăiau normal şi NIMIC NU ANUNŢA IADUL NUCLEAR din aprilie 1986 | Foto galerie Cernobîl, partea nevăzută cu şase ani înainte de explozie. 14 Iulie 2016 MIcrobi de la Cernobil vor fi analizati in spatiu! Nava Dragon va transporta saptamana viitoare la Statia Spatiala Internationala (ISS) aproximativ o tona de material pentru 280 de experimente stiintifice, inclusiv microorganisme din Cernobil, a 23 Iunie 2016 Răzvan Raț, primele reacții după ce Iordănescu l-a lăsat fără banderola de căpitan: ""M-am simțit [MASK] și mi-a fost răpită mândria de a deschide EURO"". Ce a spus despre catastrofa din Franța Răzvan Raț a vorbit deschis în cadrul unui interviu acordat jurnaliștilor de la ""Gaazeta Sporturilor"" despre decizia selecționerului de a-l lăsa fără statutul de lider al vestiarului, dar VIDEO GE-NI-AL! Superexecuție a lui Hagi la ultimul antrenament al Viitorului!",['rănit'],[MASK] rănit
fulg_sha1:EGT3AGO,"paul_85 Si la mine merge bine,deocamdata. Bogatul nu este cel ce are mult ci acela care are nevoie de mai putin Eu sunt încă pe Ubuntu 11.10. Dar am instalat în dual Xubuntu 12.04 și pot spune că sunt foarte [MASK] de el. Mâine îl voi instala pe desktop acasă. eu am șters beta ieri și am instalat ""oficialul 12.04"" după vro 6-7 ore de configurări, la un restart nu mai mergea decât tty1, am încercat până la vro 3 dimineața să repar din terminal /etc/fstab, se pare că tot crăpa partiția de swap (nu știu exact cauza, o fromatam in tip swap, notam noul uuid in fstab, iar dupa restart iară se distrugea).",['mulțumit'],[MASK] mulțumit
fulg_sha1:IIWNNTU,"Mă voi oferi voluntar, pentru a-i ajuta pe cei dragi şi pe prietenii mei. Voi mânca şi voi bea sănătos, pentru a-i arăta trupului meu, profunda mea recunoştinţă pentru existenţa sa şi pentru rolul pe care îl joacă în protecţia sufletului şi spiritului meu. Îmi voi recita mantrele şi rugăciunile în orice moment în care mă simt [MASK] de gânduri care creează nelinişte. Voi asculta pe cineva care are rar ocazia de a fi auzit. Voi fi conştientă de respiraţia mea şi de ritmul bătăii inimii mele.",['copleşită'],[MASK] copleşită
filmot_nYS5AUnbJB8_1105,Da mamă clădirile astea par abandonate frate uite și pe ăia doi care stau acolo î sparți dar aici mă așteptam oarecum. Îmi era [MASK] că prea stătea prea stătusem mult la țară fără să văd drogați și fără să văd oameni nebuni prea am stat liniștiți acolo ne.,['dor'],[MASK] dor
filmot_7TlRd-b6uns_3083.4,mă simțeam [MASK] că nu lucrez mai mult când lucram.,['vinovată'],[MASK] vinovată
fulg_sha1:GBYYNTN,"Soţul şi-a uitat telefonul acasă. Când s-a întors de la serviciu, a găsit două mesaje: 1. De la amantă: ""Dragul meu, iubitul meu, mi-e [MASK]. Pup...Citeşte mai mult » Horoscop Berbec S-ar putea sa suferiti pierderi financiare ca urmare a esecului unei afaceri in care v-ati pus mari sperante. Relatiile cu partenerii de afaceri sunt tensionate si din cauza dificultatilor de comunicare.",['dor'],[MASK] dor
fulg_sha1:6MMM6YB,"Între inițiativele sale legislative se numără declararea anului 2021 drept ""Anul Tudor Vladimirescu"" și declararea lui Tudor Vladimirescu și a Ecaterinei Teodoroiu drept eroi ai poporului român. De asemenea, dorește instituirea zilei de 15 februarie drept Zi a Lecturii Naționale. Citeşte şi: Premierul Cîțu a anunțat revocarea ministrului de finanțe, Alexandru Nazare: ""Ministrul interimar voi fi eu"" Florin Cîțu, întrebat de remaniere: ""Dacă sunt [MASK] de cineva, o spun public"" Circul ieftin din PNL costă mult. Când Cîțu face tumbe prin țară, iar Orban înghite flăcări, noi plătim Alexandru Nazare Share pe Whatsapp Share pe Whatsapp Share pe PinterestShare pe TwitterShare pe LinkedInShare pe Facebook PE ACELAȘI SUBIECT DOCUMENTE EXCLUSIVE: Ministerul Finanțelor a avertizat Ministerul Culturii că riscăm despăgubiri mari, dacă introducem Roșia Montană în UNESCO 22 Iul Citește mai multe...",['nemulțumit'],[MASK] nemulțumit
filmot_lSQu2WGsngI_317.9,Să dea telefon la Preasfințitul Gherasim putneanul să îl întrebe că și îmi era [MASK] că nu cumva să moară neîmpărtășită prinde și cu sfintele taine. În mâinile țineam la piept acoperite fiind cu procovăț ul întru nimic.,['frică'],[MASK] frică
fulg_sha1:6CS2II5,"... TreimeHarta situluiContacteProfețiile timpului Caută informaţia necesară: Logare: Utilizator Parolă Ţine-mă minte Aţi uitat parola? Aţi uitat utilizatorul? Creaţi un cont Biblioteca ortodoxă Articole Ortodoxia.md Iertarea este Cer, atunci când cer iertare Mi-a spus odată un preot, pe când eram [MASK] de mânie, iar patima mândriei clocotea ca într-o oală sub presiune care abia aştepta să iau capacul, că pentru a-mi controla pentru început aceste porniri, asftfel încât cu timpul să le abandonez, trebuie să cer iertare de 70 de ori câte şapte.Probabil că veţi avea inerţia de a mă corecta, căci acestea sunt cuvintele Mântuitorului, şi vă dau dreptate; numai că părintele a adăugat acestui îndemn urmâtoarele: ""fără să fi greşit"".Ce să înţelegem, iubiţi creştini?Că iertarea, atât cerută cât şi oferită, este aducătoare de smerenie. Iertarea cerută atunci când ne recunoaştem o greşală, ne eliberează de o încărcătură sufletească, iar acest pas făcut de noi îl înduioşează pe cel vătămat e...",['stăpânită'],[MASK] stăpânită
fulg_sha1:DJTJBT5,"...CCEPTUL UE ŞI AL SUA ATUNCI CÎND VORBEŞTE DESPRE R. MOLDOVA CA FIIND UN TERITORIU ROMÂNESC? MINISTERUL CULTURII A PREMIAT 13 PERSONALITĂŢI CARAGIALE: ""MI-E [MASK] DE PROŞTII RĂI!"" COLEGIUL DE ARTE DIN SOROCA VA PURTA NUMELE LUI NICOLAE BOTGROS O TELEVIZIUNE DE LA BUCUREŞTI ÎI FACE PE MOLDOVENI ŢIGANI, CERŞETORI, LĂTURI, TÎMPIŢI ŞI CURVE RAPORTUL PRIVIND LIBERA CIRCULAŢIE FĂRĂ VIZE A MOLDOVENILOR ÎN UE MIHAI EMINESCU, OMAGIAT DE ZIUA NAŢIONALĂ A CULTURII STATUL ALOCĂ ÎN PREMIERĂ BANI PENTRU RESTAURAREA MONUMENTELOR DE ARHITECTURĂ ŞTIRILE SPORTIVE PRIMELE JOCURI OLIMPICE DE IARNĂ DIN ISTORIE CRISTIANO RONALDO A CÎŞTIGAT BALONUL DE AUR ACTORUL MIHAI CURAGĂU, DECORAT CU ORDINUL REPUBLICII RECVIEM PENTRU UN SPION RUS PLDM SALUTĂ PROPUNEREA DE ABOLIRE A REGIMULUI DE VIZE CU UE HOROSCOP 2014 Mementomai mult FORMUZAL, UN SABOTOR PERICULOS ŞI DEPĂŞIT DE EVENIMENTE COMUNISMUL, POLITICA ŞI RELIGIA ÎN R. MOLDOVA CEDO SĂ VĂ JUDECE! MARIAN-JEAN MARINESCU, NOMINALIZAT LA PREMIILE ""EUROPARLAMENTARU...",['FRICĂ'],[MASK] FRICĂ
fulg_sha1:AKX7VJU,"Finala Cupei Davis Belgia - Marea Britanie e în direct pe Dolce Sport. Ce spun jucătorii VIDEO România privește spre încredere spre Campionatul Mondial de handbal. Tomas Ryde: ""Sunt [MASK]"". Competiția e în direct pe Dolce Sport 9:56 Tocală: ""România a pierdut pregătirea pentru Rio când a tăiat bugetele pentru juniori, din 2008"" Program TV ZOOM SPORT (TALK-SHOW) - DIRECT DIRECT UEFA CHAMPIONS LEAGUE: ASTANA - BENFICA DIRECT UEFA CHAMPIONS LEAGUE: CSKA MOSCOVA - WOLFSBURG STUDIO UEFA CHAMPIONS LEAGUE - DIRECT Vezi tot programul TELESHOPPING FOTBAL LIGA II: MIOVENI - UTA (DIRECT) FOTBAL LIGA II: CEAHLAUL - RAPID (DIRECT) REZUMAT UEFA CHAMPIONS LEAGUE UCL: Manchester U...",['optimist'],[MASK] optimist
fulg_sha1:M5UX475,"Am candidat la Medicina Generală. Acum sper să fie OK cu rezultatele. Am scăpat şi sunt foarte [MASK]"". Purtătorul de cuvânt al UMFT, Andrei Motoc, a declarat: ""Interesul candidaţilor pentru studiile medico-farmaceutice ne onorează. Ca atare, Universitatea de Medicină şi Farmacie Victor Babeş din Timişoara s-a pregătit bine pentru acest eveniment.",['bucuroasă'],[MASK] bucuroasă
fulg_sha1:WXA77CB,"Ce discută cei mai puternici oameni din lume în Franța. Cine sunt cei care participă la Summitul G7 29 martie 2019 Kovesi, sub control judiciar. Reacția unui oficial de peste ocean: ""Sunt [MASK]"" 28 februarie 2019 Corupție la nivel înalt! Probleme mari pentru Justin Trudeau! Dezvăluri uluitoare din Canada E jale!",['Tulburat'],[MASK] Tulburat
fulg_sha1:OKF2DVQ,"..mai mult emoții, decât cuvinte. BANALITĂȚI DIN SUFLETUL UNUI LUPTĂTOR Search Main menu Skip to primary content Skip to secondary content Cuvinte aranjate cu grijă Istorioare Work & Travel – Istoria unei schimbări Când am să fiu mare. Când eram [MASK].. Gândurile au aht. Călătorie cu destinații multiple.",['Dor'],[MASK] Dor
