id,input,labels,t5_trg
fulg_sha1:D3HL6ML,"Si a inceput sa enumere strazile, cladirile! S-a oprit: ""Iata Palazzo Pitti, iata un alt palat cu arcuri- sa faci la fel ca si acolo- cele trei etaje de jos ale cladirii cu o zidire masiva si cu doua arcuri la intrare"". Eram [MASK] de vedenia ei. Dimineata am sosit la institut, am aplicat calc pe proiect si cu tus maro am facut toate corecturile. La ora 10 a sosit comisia.",['uluita'],[MASK] uluita
filmot_7VFW2OXuF6k_2329.4,Hai să facem ceva toți să știi că ți am simțit. Lis aici și în special. Ștefania am văzut că am fost destul de [MASK] în absența ta era supărată tare părea destul de supărată era supărată pentru că nu știa ce se întâmplă.,['demoralizată'],[MASK] demoralizată
fulg_sha1:2BYYFOE,"i.c.: Dor de Moldova? De usturoi? g.p.: De măliga şi usturoi mi-i [MASK] tot timpul, chiar stand în ""nijlocu"" Moldovei. Nu ştiu dacă mi-i dor de Moldova. Nu m-am gândit insistent-analitic la asta,poate fi ca şi cu usturoiu cu mm, să mi se facă dor brusc de ea,de Moldova, doar aflându-mă în măruntaiele, adică pe teritoriul care poartă numele respectiv.",['dor'],[MASK] dor
fulg_sha1:4IF6QXL,"(exceptându-le pe ale mele, desigur) Tot ce mai aud (vorbindu-se, gândindu-se, făcându-se) e fie de un mauvais-gout ordinar, fie teribil de obtuz. Sunt într-o plutire în care extremele s-au redus la îngustime, în care ele nu mai există ca extreme, ci ca amici care, peste noapte și-au dat seama că se atrag. Mi-e [MASK] de sindromul Crusoe, mi-e teamă că atunci când o să naufragiez, n-o să-mi mai doresc vreodată să mă întorc, iar naufragiul ar deveni subit, evadare. O evadare necesară spiritului. Un spirit pe care, acum și mai mult ca sigur și mâine, mi-l simt și mi-l voi simți îngrozitor de emasculat.",['teamă'],[MASK] teamă
fulg_sha1:M46WWSA,"Luni, Comisia specială de Bonuri valorice pentru reciclarea deșeurilor. Cât primești pe un PET Compania Green Group, în colaborare cu Primăria Municipiului Buzău și Carrefour România, au inaugurat miercuri prima stație inteligentă de colectare a deșeurilor din România, Tăriceanu, despre excluderile din PNL:""Mi-au lăsat un gust amar. Sunt [MASK] că am fost nevoit să asist la o execuție publică"" Fostul premier Călin Popescu Tăriceanu a afirmat că excluderea din PNL a lui Andrei Chiliman și a Dianei Tușa i-au lăsat un gust amar și a lăsat să se înțeleagă că altele ar trebui să NEWS ALERT. Fațada unei clădiri s-a PRĂBUȘIT în centrul vechi al Capitalei. Imobilul se afla pe o stradă unde sunt terase și magazine O parte dintr-un imobil cu două etaje, situat pe strada Blănari din centrul istoric al Capitalei, s-a prăbușit astăzi, dar din fericire nu au existat victime, potrivit purtătorului de cuvânt al Locurile din România unde se întâmplă minuni.",['trist'],[MASK] trist
fulg_sha1:XEDRV2S,"...zezi pe nişte oameni acolo şi îi baţi prieteneşte cu palma pe umăr, e bine să îi chemi şi când se hotărăşte cine conduce destinele unui guvern"", este de părere Ioan Popa. Pe de altă parte, primarul Reşiţei a remarcat faptul că, deşi a fost necesară împărţirea ministerelor între trei parteneri de coaliţie, PNL, USR-PLUS şi UDMR, nu s-a revenit la vechea structură a Executivului, cu peste 20 de ministere. ""PNL a coborât nivelul de ministere de la 24 la 17 şi eu sunt [MASK] că, deşi a trebuit să împărţim ministerele între trei parteneri, s-a reuşit menţinerea numărului la 17 plus 1. Deci, nu ne-am dus înapoi la 22-24 de ministere, să refacem drumul spre consumuri financiare inutile"", a declarat Ioan Popa. Referitor la faptul că PNL Caraş-Severin nu mai are niciun ministru în noul Guvern, Ioan Popa a precizat că ""noi, Caraş-Severinul, am avut un ministru plin, pe Marcel Vela la Interne, dar în condiţiile în care din 17 ministere rămâi cu 9, pentru că au trebuit împărţite cu ceilalţi...",['mulţumit'],[MASK] mulţumit
fulg_sha1:EZGJ67W,"poezie, proză, eseu, teatru, jurnalstică, evenimente literare Postări bloguri personale Adăugare Sincere dorințe Postat de Daniel Aurelian Rădulescu în Ianuarie 3, 2012 la 6:32pm Vezi blog Stau zile-ntregi pierdut în timp, Visez cu ochi deschiși trecutul; Parcă mai ieri era-nceputul Când ne-ntâlneam cu suflet ghimp... Ți-am dat un telefon aseară -Tot eu, căci nu mai am [MASK]- Să ne-ntâlnim așa-ntr-o doară, Chiar de n-ar fi nimic să fie... Repeți într-una că te mint Și nu e pentru prima dată Când îți promit -dar mă dezmint- C-o să-ți fiu frate sau un tată. Insist, cu frica de-un refuz, Că doar vom sta un pic de vorbă; Ne vom plimba-n autobuz Și vom mânca pe burtă...",['mândrie'],[MASK] mândrie
fulg_sha1:TNZJE44,"Hârleţul dădu nu peste mult timp de un obiect metalic care, scos din pământ, aveaforma unei mari cuti de biscuiţi. Era pecetluit cu un fel de plasture, dar graţie briceaguluilui Tommy îl deschiseră fără greutate. Tânăra femeie scoase un suspin constatând că ea nuconţine nimic altceva decât cartofi.— Să continuăm să săpăm, Tommy.Nu le trebuiră mult timp spre a descoperi a doua cutie care, la fel ca prima, era plinăde cartofi.— Totdeauna, a treia oară se arată dreptatea, spuse Tuppence drept consolare.— Tare mi-e [MASK] că toată povestea asta nu e decât o simplă... poveste.A treia cutie fu scoasă în sfârşit şi, cuprinsă de febră, Tuppence îi desfăcu cercul.— Din nou car... Oh, Tommy...",['teamă'],[MASK] teamă
fulg_sha1:YCU4OAR,Secretul greu dezvăluit în toiul nopții S-a aflat! Mutarea la care scena politică se cutremură din temelii. News Alert Ludovic Orban despre negocierile cu Ponta: sunt [MASK] Mai puțină birocrație și mai puțini funcționari. De când se va întâmpla asta ULTIMA ORA! Vesti despre Constantinescu!,['optimist'],[MASK] optimist
fulg_sha1:3OTYBEP,"Îi observam efectele doar după aplicare: părul rămânea mătăsos și fin, dar în același timp uscat, era foarte ciudat. Se descurca ușor, mirosul rămânea în păr, dar nici măcar nu-mi disciplina vârfurile, doar stătea mai pleoștit și mai drept. Sunt [MASK] de acest tratament și categoric nu îl mai cumpăr, nu am observat nicio îmbunătățire și nici nu mai am ce discuta, sunt supărată pe el :-)) Mă consolez cu gândul că oferă protecție termică și o fi fost mai bine decât nimic... Ingrediente(click pe poză ca să devină mare): Publicat de aura la 19:51 Trimiteți prin e-mail Postați pe blog!Distribuiți pe TwitterDistribuiți pe FacebookTrimiteți către Pinterest Etichete: profesionale, protecţie termică, tratamente păr 5 comentarii: darlyst 15 ianuarie 2014, 20:51 Ce tare ai fost cu ""sunt suparata pe el""! :) RăspundețiȘtergere Răspunsuri aura 15 ianuarie ...",['dezamăgită'],[MASK] dezamăgită
filmot_3PWlgc2tjZU_110.4,ușă cu ele și le am văzut și ai zis să mănânc și eu m am înfipt în ciocolată o fi de bine zic oricum eram foarte [MASK] și erai și foarte frumos îmbrăcat toate erau delicioase. Așa și când mi ai dat să gust și din altă ciocolată.,['bucuroasă'],[MASK] bucuroasă
filmot_yt88hF8udiY_3244.5,Sunt [MASK] mi e dor de ursuleții mei cum ați. Poftim scump. Uau o acadea în formă de steluță e delicioasă are gust a ursuleț gumați căluțule.,['trist'],[MASK] trist
fulg_sha1:MIDTSPH,albusteluta spune: Eu trebuie sa recunosc ca am ramas la partea cu fotogafiile in care arati minunat! Am lasat pe loc secund evenimentul pentru ca recunosc cea de-a doua fotografie ti-a iesit super ! Ramona Gheorghe spune: Ma simt [MASK] de expresivitatea ta si de cat de frumos te pui in valoare in poze! Este tu … ai un fel al tau de a fi extrem de natural si de frumos! Esti o dragalasa!,['captivata'],[MASK] captivata
fulg_sha1:C2553SG,"...ntre cele mai ""tranzitate"" cabinete în ultimii trei ani. Nu mai putin de cinci ministri s-au perindat pe aici din (...) Victor Ponta: Sper să avem azi sau mâine un nou ministru al Transporturilor Primul Ministru a declarat, miercuri, la sedinta de guvern ca este ""foarte îngrijorat"" în ceea ce priveste conflictul de munca de la Romatsa. ""Referitor strict la Transporturi sunt foarte [MASK] si vad conflictul de munca de la Romatsa, sper sa avem azi, m&aci (...) Ponta i-a propus lui Iohannis numirea lui Fifor drept ministru al Transporturilor Conform surselor citate, propunerea de nominalizare a noului ministru a fost transmisa vineri la Presedintie. Joi, surse guvernamentale au declarat ca Fifor ar putea fi nominalizat de catre premierul Victor Ponta pentru postul de ministru al Transporturilor. Postul de ministru este vacant de aprox (...) Senatorul PSD Mihai Fifor ar putea fi noul ministru al Transporturilor!",['îngrijorat'],[MASK] îngrijorat
filmot_Ma8ROSRzwNk_656,Încercam Pe cât se poate de mult să nu afișez deloc că mă simțeam [MASK] de întreaga discuție și îmi făcusem deja un plan în mănânc termin de băut vinul cerem nota eu plec acasă și î gustu pentru.,['deranjată'],[MASK] deranjată
fulg_sha1:5KKHDR4,"În viața mea nu am făcut acest lucru până la acel moment, dar a fost o experiență foarte frumoasă"", a mărturisit avocatul pentru axanews.ro. El a povestit că a învățat singur limba română: ""Atunci comunicam în limba engleză cu ceilalți, dar dintr-o dată am zis ca nimeni să nu mai poveastească cu mine în limba engleză pentru că vreau să învăț limba română. Am cerut ajutor pentru orice greșeală care o făceam pentru că nu îmi era [MASK] să învăț"". Absolvent al Facultății de Teologie și al celei de Criminalogie în Coasta de Fildeș, Yeboua Moussa Ouattara a depus jurământul, devenind oficial avocat, în cadrul ceremoniei organizate de Baroul Maramureș în data de 17 octombrie, fiind unul din cei 17 noi avocați care au intrat în barou. La depunerea jurământului a participat și părintele Irineu, cel care l-a salvat de infernul din țara natală.",['rușine'],[MASK] rușine
fulg_sha1:UG4NZI3,"Precum am mai spus-o şi alte dăţi, guvernul american devine din ce în ce mai despotic. Eu mă amuz cum unii cu minte puţină mă consideră a fi ""anti-american""… şi probabil că după ce voi publica şi articolul acesta, voi fi considerat ""cel mai mare american din România"" ""Deştepţilor"", eu sunt împotriva cenzurii şi despotismului, de oriunde ar veni el (Rusia, SUA, Coreea de Nord etc.). Însă, sunt [MASK] de propaganda actuală din mass-media care prezintă SUA cel mai democratic stat din lume, iar alte ţări (care se opun politicii americane) sunt considerate a fi ""despotice"". Aşa că în acest articol am să lucrez cu ""materialul clientului"", adică m-am folosit de un articol publicat pe site-ul american The Truth. Articolul respectiv e scris de Michael Snyder, un fost avocat din Washington.",['sătul'],[MASK] sătul
rosent_909,"daca as putea sa dau stele zero pentru asta, dar, din nefericire, trebuie sa dau una ... <br /> <br /> nu exista nicio scena in care sa rad despre ... dar jocul nu ma facut razi fie. deci, daca sunteti un popor prost intarziat, mergeti la cinematograful local, vizionati acest film si dati-i 10 stele, cum au facut deja unii oameni. dar pentru mine ... intr-un film unde copiii sunt impuscati pentru a atinge umorul ... gustul bun trece peste margine ... aceasta a fost a treia oara cand mi-am irosit timpul sa vad un film boll si a fost cu siguranta ultima mea! 0 / 10 ... mi-e [MASK] de a fi din aceeasi tara ca uwe boll! va rugam sa va rugam sa-l pastrati din mai multe filmuri !!!!!",['rusine'],[MASK] rusine
fulg_sha1:Z6Q7MGZ,"...lt ucigaş ascuns în carne şi lapte este estrogenul, conţinut de medicamente folosite pentru creşterea fertilităţii. Numeroase studii au arătat că această substanţă este cancerigenă.Joomla Templates and Joomla Extensions by ZooTemplate.Com Mai multe articole.. O româncă rezidentă în Italia, câștigătoare a concursului ""MasterChef"" din România Rețeta săptămânii: Pui pe sticlă de bere România e aproape să depăşească Italia la producţia de autoturisme în 2013 Rețeta săptămânii: Lapte de pasăre Pagina 1 din 35 « Început Anterior 1 2 3 4 5 6 7 8 9 10 Următor Sfârşit » Cele mai RECENTEcititecomentate Aruncată în stradă după moartea bătrânei asistate: ""Sunt [MASK], singură și neajutorată"" Drama unei mame plecate la muncă în Italia. ""Nu mi-am văzut copilul de nouă ani"" Accident cumplit în Calabria: doi morţi şi şase răniţi în microbuzul condus de o româncă ""Nu-mi închipuiam că aici în Italia voi întâlni atâta ură și invidie între conaționali"" ""Fac colațiune"" sau ""mă candidez"", explicații...",['disperată'],[MASK] disperată
fulg_sha1:I7QIYQZ,"...ia care este prinsă cu minciuna Ce tarife au vedetele pentru a cânta la Balul Bobocilor. Andreea Bălan ia 2.500 de euro Dana Rogoz, victima abuzului în adolescență. ""M-am simțit [MASK], dezgustată, speriată"" Ce spune forma sprâncenelor despre caracterul tău Povestea unui tânăr care a scăpat de păcatul MASTURBĂRII Zumi Pagina ta online Monden cu Iulia Vedete autohtone Vedete internationale Evenimente Cinema Sport TV Modele Artiști Sănătatea ta Psihologie Ginecologie Cosmetologie Dietologie Mama și copilul Sfaturi Moda Țoale Încaltaminte Accesorii Colecții Shopping Trendy people Stylebook Beauty Coafură Machiaj Unghii Piele Masaj Recomandari În doi Relații Sex Găseşte-ţi perechea Istorii de viaţă Homosexuali Despre el Food and drinks Învaţă să găteşti Mâncare sănătoasă Alcool Non alcool Sfaturi utile Fii în formă Lifestyle Events Casă şi grădină Maşină Social Media Tehnologii Horoscop Free time Hong Kong Articole Homosexuali Important În doi În Hong Kong s-au permis căsătoriile între TRANSEXUALI 27 iulie 2016 27 iulie 2016 Zumi 0 Comentarii Căsătorie, Hong Kong, lege, transexuali Cuplurile transexuale din Hong Kong se vor putea căsători legal. Asta după ce Curtea de Apel a declarat neconstituţională actuala legea care interzice bărbaţilor care şi-au schimbat sexul în cel feminin să se căsătorească. Patru din cei cinci judecători au susţinut decizia instanţei, iar un judecător a votat împotri...",['neajutorată'],[MASK] neajutorată
filmot_ISJe0mb8cT0_4823.4,Nici jumătate din bani nu. Și i a dat înapoi îmi era [MASK] de chestia as și uite că a fost bine până acum. Așa că eu zic să așteptăm un pic ne ducem în 500 vedem.,['frică'],[MASK] frică
fulg_sha1:AR7OQYK,"...struatiei de 4 luni nu am avut deloc menstruatie si mam ingrasat fff mult.am mers la ginecolog si miau dat pastile pt provocarea menstruatiei si mi au spus ca in prima zi de ciclu sa iau ... anticonceptionale karissa, tetraciclina si prednison richter, periculoase? ...mea este daca se poate cumva aceasta `combinatie` de pastile sa imi faca rau, simt ca m-am ingrasat, mentionez ca am un regim alimentar echilibrat si nu mananc sare din cauza prednisonului.multumesc anticonceptionale ...ca am 53 kg si ma mentin nu m-am ingrasat deloc ma simt [MASK] nu am nici un fel de probleme ,dar de curind am consultat un endocrinolog si mi-a zis ca ori renunt la pastile ori la tigari dar nu pot renunta la nici una pentru a te lasa de ... vreau sa slabesc ...a fost de cateva kg max3 si dupa mam ingrasat la loc.am auzit de ""capsula de sabit"" se gaseste in farmacii.eu iau pastile anticonceptionale stodette.asa mia recomadat mediucul in uram cu 1 an.daca iau aceste pastide de slabit ... Cum putem sa st...",['bine'],[MASK] bine
fulg_sha1:4VVEYXC,"Copila e fericita. Stie despre ce are de invatat la istorie. Eu sunt [MASK]. Cineva a reusit sa-mi smulga un zambet la jumatatea zilei :) Publicat de ileana la 20:44 Niciun comentariu: marți, 13 septembrie 2016 A doua zi de școală Din prima zi de școală nu am nimic glorios de relatat. Nu avem nici măcar o poză.",['fericita'],[MASK] fericita
filmot_XEDV1iKtK0w_6604.2,Deci m am simțit foarte incomod și spuneam că eu mă simt foarte [MASK] nu ai plecat. Da nu știam ce să fac. Nu știam ce să fac am.,['vinovată'],[MASK] vinovată
filmot_zbImnZCMaME_1665.5,Singurul lucru care m a făcut să mă simt mai [MASK] a fost că era un drum aproape de locul în care am fost capturat și în curând am fost am putut să întreb.,['calm'],[MASK] calm
fulg_sha1:FSHOBS5,"Mulți elevi, și chiar părinți, pun la îndoială validitatea unor cursuri ce nu le transmit cunoștințe practice imediate, de folos pentru viața de zi cu zi. Unii elevi (și profesori) își exprimă dubii asupra necesitații testelor, susținând că fiecare are ritmul propriu de învățăre, deci testul nu poate fi relevant. Destul de rar am avut ocazia să văd, să simt [MASK] pentru o materie, pentru un profesor. De multe ori se afișează masca plictisului sau a suficienței. S-ar putea să fie doar o mască, și nu se poate să nu existe excepții, dar ce mi-e mie dat să aud cam așa sună.",['entuziasm'],[MASK] entuziasm
fulg_sha1:V3RLLYZ,"...colet – să nu spui la nimeni, dar am lăsat toate baltă şi fuga la birou. Ajunsă, am găsit coletul bine împachetat şi odată ce am văzut sigla aoro....m-am luminat la faţă, nu mi-a luat mult să deschid coletul....şi odată ce am văzut cutiuţa parfumului, am rămas impresionată de eleganţa acesteia....totul decorat în măsură...ambalajul, cutiuta, capacul parfumului – toate acestea dovada luxului oferit de Guerlain. Atâtea sunt de spus, despre acest parfum încât îmi este [MASK] că nu vei ajunge să citeşti până la final această postare, dar uite am păstrat ce e mai bun pentru final. ""Flora Nymphea"" floarea casei Guerlain, după cum îţi imaginezi nu este un parfum ca oricare altul, în primul rând pentru că îl port eu, apoi pentru esenţele care acum cu venirea toamnei s-au metamorfozat într-o aromă gustoasă....da, da, ai citit bine – gustoasă. Ambrozie curată, acest parfum un nectar al nimfelor – (apropo, la aniversarea de 10 ani a acestui parfum, casa Guerlain a prezentat un mini filmuleţ a...",['teamă'],[MASK] teamă
fulg_sha1:XST6YQM,"Cu toate astea, maşina s-a comportat excepţional. Peste aşteptări. Ar mai fi cerut unele provocări, însă eu eram [MASK] ca un arc. Instructorul se amuza copios pe seama neîncrederii mele, spunându-mi că acest traseu este special ales pentru a simţi puterea maşinii. Am simţit-o din plin.",['tensionat'],[MASK] tensionat
filmot_XvN2BqaqJ00_2609.6,Ce s a întâmplat cu noi ce s a întâmplat și interacțiune între și Patrick și cu biletele și cu jocurile și aveam un moment nu de regret nu de nimic doar eram [MASK] pentru că nu înțelegeam ce se întâmplă cu mine. De ce am stările alea.,['șocat'],[MASK] șocat
fulg_sha1:BNQTSPJ,"""E un muzeu minunat. Sunt uimită de valoarea lucrărilor de artă românească, de artele decorative din țara dumneavoastră. Am fost [MASK], cu adevărat, de monumentalitatea și relevanța istorică a acestui spațiu"", a spus artista. În cadrul întâlnirilor diplomatice, artista a avut întrevederi la sediul Ministerului Afacerilor Externe, cu domnul ministru Teodor Meleșcanu și, la sediul Ambasadei Portugaliei, cu E.S. domnul Fernando Teles Fazendeiro, Ambasadorul Republicii Portugheze în România.",['impresionată'],[MASK] impresionată
fulg_sha1:POYF4GK,"Sunt născută şi crescută în satul Fânaţe, şi aşa cum probabil aţi aflat, nu de mult am împlinit 60 de ani. Am fost căsătorită, şi am doi copii, adică două fete, frumoase şi isteţe, căsătorite la rândul lor şi care mi-au dăruit, nepoţi. chiar pot spune că sunt [MASK]. Să vă trăiască cei dragi, iar dumneavoastră mulţi ani înainte, cu sănătate şi cu multe bucurii. Se vede împlinirea şi bucuria pe faţa dumneavoastră.",['împlinită'],[MASK] împlinită
filmot_itnvwpbJt0s_2550.2,La revedere hai la revedere mult mai bine acum fiecare pe alt drum când eram cu tine. Eu mă simțeam bine. Acum că ai plecat. Mă simt [MASK]. Hai șterge iubire pozele cu mine spun pa pa acum. Hai vezi iți de drum când eram.,['minunat'],[MASK] minunat
filmot_z0lMrdCRde4_155.2,în zor am rămas cu amintiri și poze care dor. Dor dor mi este dor dor dor dor. De ce mă dor? Am rămas cu amintiri și poze care dor. Dor dor dor. Îmi este [MASK] dor dor dor. De ce mă dori?,['dor'],[MASK] dor
fulg_sha1:QFMMJQ3,"... Meniu Sari la conținut Acasă Ştiri Muzică/Lansări Controverse Drame/Filme Emisiuni Interviuri Concerte/Evenimente Modă Random stuff Recenzii Nota autorului Despre noi K-Facts: Blogul şi Echipa K-pop Romania Versuri K-Facts K-Stuff Debuturi 1996-2000 Debuturi Solo K-Expresii Contact Privacy Policy Versuri: Twilight – ONEUS Lasă un răspuns Ravn | Seoho | LeeDo | Keon Hee | Hwanwoong | Xion Soarele roșu e umbrit de întuneric Pierzând lumină și întreptându-se spre asfințit [LD/KH] În acea pădure fără sfârșit Deasupra i se oprește soarele la răsărit Soarele e în cădere, în amurg În amurg, e în cădere Soarele e în cădere Soarele ferbinte se stinge coborându-se În locul tău gol, vine o stea Clipele care am crezut că vor dura veșnic Acum se răsfiresc în toate părțile Și ziua, și noaptea nu au un sens, ceasul de pe masă O lumină stelară a lunii în forma ei frântă Soar golul a rămas, nu mă pot împăca cu asta Singura lumină din lume [Xion/KH] În acea pădure fără sfârșit În amurg, tu și eu Când soarele cade și dispare Tu, ce-mi străluceai luminos, cădeai tot mai jos Căzând în jos, căzând în jos Soarele cade, cu ultima minciună, nu pleca Choar dacă vine întunericul eu nu acopăr lumina Ia-mă de mână, oricum asta va trece peste toate Mi-e [MASK] de tine mai mult și mai mult, e ireversibil [HW/KH] În acea pădure fără sfârșit Soarele cade Când întunericul dispare în zori La sfârșit și tu vei reveni la locul tău Frumoșii copaci în floare mor și ei Bestia feroce va fi și ea fără suflare Pe un pământ negru ce s-a înghețat dur [SH/LD] Apar stelele în cerul negru al nopții Mi-e dor de tine, văzând cum umbrele trec Căzând, căzând, soarele e în amurg Ultima minicună, nu pleca Soarele asfințește Evaluează asta: Împărtășește: Dă clic pentru a partaja pe Facebook(Se deschide în fereastră nouă) Dă clic pentru a partaja pe Tumblr(Se deschide în fereastră nouă) Dă clic pentru a partaja pe Twitter(Se deschide în fereastră nouă) Dă clic pentru a partaja pe Pinterest(Se deschide în fereastră nouă) Dă clic pentru a partaja pe LinkedIn(Se deschide în fereastră nouă) Clic pentru a trimite prin email unui prieten(Se deschide în fereastră nouă) Dă clic pentru a partaja pe Pocket(Se deschide în fereastră nouă) Clic pentru imprimare(Se deschide în fereastră nouă) Apreciază: Apreciere Încarc... ...",['dor'],[MASK] dor
fulg_sha1:22AUQPE,"...a schimbat […] Vezi articolul Michael Jordan donează un milion de dolari victimelor uraganului Dorian din Bahamas Fostul mare baschetbalist american Michael Jordan a anunţat, marţi, că va face o donaţie de un milion de dolari organizaţiilor umanitare pentru a veni în sprijinul populaţiei din Bahamas, lovită săptămâna trecută de uraganul Dorian, relatează AFP. ""Sunt [MASK] de distrugerea provocată de uragan în Bahamas"", a declarat Jordan, care posedă o proprietate în acest […] Michael Schumacher, internat pentru o terapie secretă la Paris Michael Schumacher a fost internat într-o clinică din Paris pentru un tratament secret. Presa franceză scrie că fostul mare campion de Formula 1 ar urma să beneficieze de o terapie cu celule stem, care sunt injectate pentru a evita inflamarea organelor interne. Întreaga operațiune de aducere la Paris a lui Michael Schumacher a fost extrem […] Laura Bretan va cânta cu Michael Bolton la concertele lui din România!",['devastat'],[MASK] devastat
fulg_sha1:USVG3R3,"Mă consider pesimistă, chit că în ultimul timp am reușit să stau într-o bulă de optimism. Cea mai recentă chestie care mi-a trecut prin cap e că vreau să iau lecții de echitație. În mod ironic, mi-e [MASK] de cai. Vreau să pot citi în franceză într-o bună zi. La pensie vreau să îmi iau un yorki(da, eu sunt aia care se gândește de acum la pensie, ha, ha).",['frică'],[MASK] frică
fulg_sha1:XBEMX4L,"Calitate foarte buna La inceput am fost putin reticenta, dar comanda a ajuns repede si produsele arata super si calitatea lor e foarte buna! Multumesc☺️ S S. incantata Comanda a ajuns ieri, sunt [MASK] de set. Are un material moale și fin. Baby Loo este un boutique de îmbrăcăminte și articole pentru copii, apărut din dragostea pentru cei mici.",['incantata'],[MASK] incantata
filmot_nJR0YMfKu6M_4984.9,Alexandru încă o dată nu mai gata. Ce faceți. Bine zici că jucam scaune vesele alea când te întors. Uite bine sunt [MASK] pentru că. Iată Claudiu încearcă să o cunoască pe Patricia Patricia pe Claudiu și mă bucur și noi. Mă bucur și Bianca și.,['fericită'],[MASK] fericită
fulg_sha1:GKGWFNW,"Vremurile alterate duc la guverne ""alterate"". Probabil va mai dura pana cand un Tepes va apare in Romania noastra. Personal sunt [MASK] de cum merg lucrurile, ma bucur insa ca nu sunt singurul care nu vrea sa ia de bun tot ce se serveste in planul coloraturii politice de la noi. Scarbitu' a scris pe 17/03/2021 la 09:21 ""O masinarie care ar trebuie sa-l controleze si chiar sa-l indrume"" ?! Cine din in gasca de sfertodocti ?",['dezamagit'],[MASK] dezamagit
