id,input,labels,t5_trg
fulg_sha1:EQJXE6P,"...Caleidoscop Sport Timp liberCaleidoscop Gastronomie Turism Comentarii Pdf CAUTA Anunţuri REDACTIE STRANIERI IN ITALIA COLF E BADANTI You are here: Skip to content Diaspora Mai multe articole.. Partidele vor să cumpere votul românilor disperaţi din diasporă, avertizează Cătălin Ivan (PSD) Cătălin Ivan, europarlamentar PSD: Votul românilor din diaspora ar trebui restricţionat Daniel Ţecu (Fadere): Românii din diaspora vor să voteze la referendum Gabriella Pavel închiriază camere la Londra: ""Românii, clienţi buni"" Scotland Yard: operaţiune sub acoperire împotriva escrocilor români care au ""ocupat"" centrul Londrei Românul cu flacăra olimpică, blocat de o italiancă: ""Forza Italia!"" Danny Sergiu, campion la K1 în Anglia Norvegia a deschis piaţa muncii pentru români Europa ia măsuri împotriva cerşetorilor români Exodul creierelor, economia României în pericol Loredan Gargalâc, singurul Executive Chef român din Anglia, despre varza călită şi produsele bio de la ţărani Mihaela, emigrantă la 49 de ani, taximetristă la Londra Schengen- Conflict între guvernele UE şi Parlamentul european/ Poziţia României Schengen/ Unele state ar putea reintroduce controalele la frontierele naţionale DRP/ Transport gratuit pentru românii afectaţi de cutremur Evacuarea avionului Carpatair: ""Ne-am aruncat de la doi metri"" Doru Prelipcean din Rădăuţi, chef la Londra, face cele mai bune sarmale din UK Natalia Intotero, noul secretar de stat la Departamentul pentru Românii de Pretutindeni Sfatul preşedintelui Băsescu pentru românii din străinătate: ""Nu vă întoarceţi acasă"" ""Englezii sunt porci, vrem case""- scandalul romilor români care au invadat Londra Pagina 7 din 14 « Început Anterior 1 2 3 4 5 6 7 8 9 10 Următor Sfârşit » Cele mai RECENTEcititecomentate Aruncată în stradă după moartea bătrânei asistate: ""Sunt [MASK], singură și neajutorată"" Drama unei mame plecate la muncă în Italia. ""Nu mi-am văzut copilul de ...",['disperată'],[MASK] disperată
fulg_sha1:75UJJ3U,"Orice ființă vie, în virtutea faptului că are o minte, este capabilă să devină buddha. Natura fundamentală a minții este pură, clară și lipsită de norii concepțiilor și emoțiilor destabilizatoare care acum o ascund. Atât timp cât ne identificăm cu stările de spirit confuze, crezând că ""eu sunt o persoană furioasă; sunt [MASK](ă); am atât de multe probleme"", nici măcar nu ne acordăm șansa de a ne schimba."" ""Cum sa meditam – Ghid practic pentru atingerea echilibrului interior"" de Kathleen McDonald … Explicarea mantrei lui Buddha, tadyatha om muni muni maha muniye svaha (pronunțată ta-ya-ta om mu-ni mu-ni ma-ha mu-ni-ye so-ha). Tadyatha – Așadar, Om – Starea iluminată; calitățile pozitive ale corpurilor, ale vorbirii și ale minților tuturor buddha. Muni – Control asupra renașterilor nefericite și asupra ignoranței cramponării de sine.",['deprimat'],[MASK] deprimat
fulg_sha1:6S6JSUE,"Functia de presedinte este o ONOARE si o mare OBLIGATIE. Reply LG ce tampenie, chestia asta cu ""cel care ne umileste pensionarii,""… bla, bla. Sunt pensionara si nu ma simt [MASK]. Imi place presedintele meu, iar eu muncesc si-mi vad de treaba. Numai niste minti inguste si vesnic manipulate dau vina pe altii sau pe altul, unul si acelasi, pentru ce li se-ntampla in viata.",['umilita'],[MASK] umilita
fulg_sha1:FVVUBYC,"Antologia aforismului românesc contemporan, ediţia a II-a 40 de aforişti reuniţi într-o colecţie memorabilă Vezi detalii despre o antologie de referinţă! Vezi aforisme despre iubire, citate de Viorel Vintila despre iubire, aforisme despre declaraţii de dragoste sau Ne poţi propune o poezie de dragoste? În tăcerea mea, te iubesc, mai mult ca oricând; în singurătatea ta, îţi sunt [MASK], ca întotdeauna. aforism de Any Drăgoianu Adăugat de Any Drăgoianu Vezi şi aforisme despre tăcere, citate de Any Drăgoianu despre tăcere, aforisme despre singurătate, citate de Any Drăgoianu despre iubire sau aforisme despre indiferenţă Marele cusur al femeilor este că te iubesc, totdeauna, când ai altceva de făcut. aforism celebru de Tudor Muşatescu Adăugat de Simona Enache Acest aforism a fost selectat Aforismul zilei pe 12 septembrie 2017.",['indiferentă'],[MASK] indiferentă
fulg_sha1:DINARH2,"Nustiu de ce am hotarit ca e o idee buna sa sparg aceasta buba si sa o tai :( Am spart-o, am scurs-o, si am incercat s-o desprind, dar ea e lipita de carne. Am pus pielea la loc si am bandajat piciorul :( Acum intrebarea, pielea se va prinde inapoi? Mi-e [MASK] :( Va multumesc anticipat pentru raspunsuri si sfaturi. 1 comentarii 0 09-09-2015, ora 22:24 Dr. Marius Uscatu Ortopedie si traumatologie, Bucuresti Buna seara!",['frica'],[MASK] frica
fulg_sha1:O64A23Q,"0 Tags: profesorişcoală You may also like... Altfel de diplome la final de an şcolar 9 Jun, 2017 Mai mult decât un ursuleţ de pluş 7 Sep, 2016 Întoarcerea la şcoală. MI-E [MASK] 13 Aug, 2020 Leave a Reply Cancel reply Your email address will not be published. Required fields are marked * Comment Name * Email * Website Save my name, email, and website in this browser for the next time I comment. Follow: Previous story Și-a făcut ghiozdanul pentru școală.",['TEAMĂ'],[MASK] TEAMĂ
fulg_sha1:RB2JU3B,"... Chiar dacă nu voi câştiga alegerile voi continua să lupt pentru a schimba prejudecăţile italienilor în ceea ce ne priveşte şi a demonstra că românii au o cultură bogată, obiceiuri şi tradiţii minunate, o bucătărie delicioasă, muzica veselă."" Andi Rădiu Abonează-te la ştirile Gazetei Româneşti Joomla Templates and Joomla Extensions by ZooTemplate.Com TRADUCERE Javascript is required to use GTranslate multilingual website and translation delivery network Cele mai RECENTEcititecomentate Albanezul care a ucis o româncă la Torino S-A PREDAT Atenționare de călătorie - Blocaje ale traficului rutier în Slovenia Românii din Anglia cer amânarea Congresului: ""Nu suntem de acord cu modul netransparent şi neconsultativ în care a fost organizat"" Consulatul de la Bologna participă la SALVAREA unei victime a traficului de persoane Aurelian Mihai în a șasea zi de greva foamei: ""Taxele reduse, ordine în consulate şi morţii acasă!"" UPDATE: Tăriceanu NU MAI VINE să se întâlnească cu românii din Roma Rezoluţia de la Torino: ""Cerem amânarea Congresului diasporei şi o nouă metodologie pentru desemnarea delegaţilor"" Catania, hoaţe în casa unei bătrâne invalide de 90 de ani 7 milioane de italieni câştigă sub 1.000 de euro pe lună Un şarpe în casa lui Calderoli: ""Tatăl lui Kyenge mi-a făcut vrăji Român de 26 de ani, ucis în plină stradă în cartierul Torre Angela din Roma Rețeta săptămânii: Rigatoni cu ton și măsline Drama unei familii de români din Scandriglia, Rieti: ""Fără contract de muncă ne repatriază sau asistența socială ne ia copiii"" Poliția rutieră italiană în alarmă: carnete de conducere românești, false, vândute cu 1000 de euro Ghinionul unui om de afaceri italian: S-a dus să se însoare în România, a murit într-un accident de circulație pe DN1 Oliveto Citra, orașul plin de miracole ARI lansează postul de televiziune al românilor din diaspora: Dacia TV Comitetul asociaţiilor, constituit la Roma, cere Guvernului României o Ordonanţă pentru Congresul Diasporei Ce conțin țigările electronice și cât de dăunătoare sunt [MASK] în cartierul Parioli din Roma: cameraman român găsit spânzurat în locuința sa Cosimo Rinaldi, Puglia: ""Ca italian îmi imaginam că în România predomină sărăcia şi violenţa"" Cristian David: ""Vom încuraja consumul de produse românești în Italia"" Noul Badea Cârțan a trecut de Torino: ""Voi depune la Columna lui Traian țărână de la Sarmizegetusa"" Sacrificiile româncelor/ Mihaela: ""Viaţă de coşmar cu o bătrână bolnavă de Alzheimer"" Ana Maria Ciornoliuc, o voce din Bucovina pe scena Auditoriumului din Roma VIDEO Au devastat un cimitir la Udine: ""Rasa cea mai scârboasă"" Drama unei mame plecate la muncă în Italia. ...",['Șoc'],[MASK] Șoc
fulg_sha1:YVPBKEF,"Problema este vietile oamnilor care nu sunt curate, sunt legate de lumea aceasta, si Duhul Sfint nu locuieste impreuna cu lumea. Daca cauti mi intii imparatia lui Dumnezeu atunci vine Duhul Sfint. Sunt cam [MASK] de raspunsurile lui Fr. A cam scaldato. Răspunde cornel iunie 22, 2011 la 10:20 pm fratilor hai sa nu fim copii…..eu promit un cadou la copilul meu si copilul insista si tot insisa pana cand il dau.",['dezamagit'],[MASK] dezamagit
fulg_sha1:HM7IG6Y,"Val 17 mai 2012 at 12:10 PM V.P. va face asta (comunicatul) cand se va pocai din inima… deocamdata a facut doar o mutare politica de interes personal (numita pe nedrept pocainta) ca sa poata ramane prin preajma…, iar CP e multumit pt ca si el tot asta cauta–imagine buna–sa iese cu fata curata in ochii lumii. Mi-e [MASK] ca si C.I. e multumit cu o ""victorie"" de suprafata…ce-i drept chiar si asta este meritul sau, altfel CP si VP nu faceau nici atat. isac filip sunt in totalitate de acord cu tine.",['teama'],[MASK] teama
fulg_sha1:JF2FJJK,"pseudopode să nu iei pseudopodele peste picior. oborul săptămânal, oneşti, 15 septembrie frica ţi-e frică? mi-e [MASK]! că n-a murit şi se ridică! rondul insomniile sunt cele mai bune pauze de la vise.",['frică'],[MASK] frică
fulg_sha1:NY6LQ3I,"G E A N T Ă Fundaţia CIREŞARII vrei o diplomă? vineri, 16 decembrie 2016 Pamãntul deocamdată - de Vladimir Pustan Am fost acuzaţi noi creştinii că suntem prea optimişti în privinţa universului şi prea pesimişti în privinţa lumii. Eu sunt creştin şi nici măcar nu sunt [MASK]. Sunt tragic dar iubesc pământul. Şi nu-l iubesc ca Martorii lui Iehova, adică pământul care va fi, în care noi bărbieriţi şi zâmbitori vom purta pepeni cu tărgile de la unii la alţii, ci iubesc pământul de acum.",['pesimist'],[MASK] pesimist
fulg_sha1:7MWMMJQ,"Il gasiti aici http://www.southparkstudios.com/ touretul Mai usor c-ai scapat caii in porumb: suntem la razboi si nu stiu eu, sau tu nu stii sensul cuvantului defetism! Calm tovarăşi! Dane Sunt [MASK], eu unul nu mai nici o ezitare in a NU ma mai duce la vot! DEFETÍSM s.n. Opinia, părerea, atitudinea celui ce nu are încredere în reușita unei acțiuni; lipsă de încredere.",['calm'],[MASK] calm
filmot_B_Q0TZyQTs0_970,"Aveam 18 ani. Vorbește într o limbă străină. Nu prea eram și puțin rușinos pentru că îmi era [MASK] să vorbesc în limba engleză pentru că aș putea face greșeli. Știam bineînțeles, limba engleză, dar nu eram la nivel nativ și atunci.",['rușine'],[MASK] rușine
filmot_KHpcdG_0aVw_39020.6,Chiar este foarte eficientă ferma asta într un fel îmi era [MASK] de ferma aceasta dar uite că n aveam. De ce să mi fie frică efectiv și uitați vă cât de și uitați vă cât.,['frică'],[MASK] frică
fulg_sha1:UPUEHF2,"... ciocneam Cu fiecare-n parte, Urale copilăreşti scoteam Pentru puţinele nesparte De Paște, mare bucurie Părinții ne făceau, Cadouri, jucării, de toate Cu drag noi le-așteptam Acum, mari ne-am făcut La rându-ne părinți, Dar n-am uitat copilăria Și de ai noștri părinți Astăzi, de Paște îți urez Mamă, tot binele din lume, Și nu uita cât te iubesc Chiar de nu-s lângă tine! Tată drag ţie ţi-aş spune Cât de duios mi-e [MASK] de tine, Şi-aş da orice ca să mai pot În viaţă eu să te mai văd Sărbătorile sunt frumoase Când ești cu cei dragi la masă, Când cineva drag a plecat Un gol în suflet ți-a rămas Iubește-i pe ai tăi părinți! Ei sunt precum niște Sfinți Cât timp sunt în preajma ta Mereu ei te vor proteja. Publicat de Adeena pe 6 mai 2013 în Poezii Etichete: mamă, Paște, părinți, Sărbătorile, tată, viață Iertare Mă-ntreb iar și iar, din nou Unde este gândul tău, Al meu sigur e la tine Oare și al tău la mine?",['dor'],[MASK] dor
fulg_sha1:GPR4TSX,"Inima vreau să o deschid, să fac un pas către Cel ce îmi oferă pace, mângâiere, fericire. E plină de păcate şi simt că nu mai pot. De multe ori spun că sunt [MASK] însă fără prea multe eforturi. Văd că sunt departe de Cel ce este Viaţa si trăiesc fără rost. Cât de mult îmi doresc să te regăsesc, poarta inimii mele să-Ţi fie mereu deschisă, iar ea, inima mea, să fie tronul Preasfintei Treimi.",['istovită'],[MASK] istovită
fulg_sha1:W4WREDL,"...am Voyage, Am gasit pe site-ul www.ocaziituristice.ro circuitul in Croatia pe care ni l-am dorit. Am fost placut impresionati ca, de la inceput, totul a mers ca pe roate: am gasit toate informatiile ..."" Claudia Garbovan (Familie cu copii mici) Ne doream o excursie frumoasa si fara incidente. Am fost foarte [MASK] sa gasesc pe internet site-ul ""www.ocaziituristice.ro"", pentru ca, varietatea mare de oferte, precum si prezentarea lor, m-au surprins in mod..."" Familia Topan (Familie cu copii mici) Multumesc Dream Voyage, Mi-am dorit un sejur linistit, de cateva zile la munte si cateva zile la mare, fiind insotita de un copil de 6 ani, doream ca totul sa fie organizat exemplar, fara incidente. Am gasit site-ul ..."" Manuela (Familie cu copii mici) Avand 2 copii mici (de 2 si respectiv 5 ani) doream sa ne petrecem un concediu linistit si fara peripetii, ales intr-un mod cat mai usor posibil pentru noi. Fiind foarte ocupati, timpul nostru liber aproape neexistand, ..."" Mergi Sus Ocazi...",['incantata'],[MASK] incantata
fulg_sha1:6GHCHH3,"tot felul de sertare și dulapuri din casele veki îmi păreau pe vremuri misterioase și când le deskideam eram [MASK] că găseam prin ele doar tâmpenii fără valoare ori istorie.. între timp misterul a cam dispărut, însă dezamăgirea e tot acolo când deskid câte unul [bloodbath – total death exhumed / grand morbid funeral] Reclame Dacă ți-a plăcut: Apreciază Încarc... Publicat în diverse, ego-iQ, furnal | Etichetat amintiri, marturisiri, mistere | Lasă un răspuns Anulează răspuns Introdu aici comentariul tău...",['dezamăgit'],[MASK] dezamăgit
fulg_sha1:YS6STSN,"...ice referitoare la timpul de răspuns"". Totodată, CNAS arată că furnizorii de servicii medicale le pot efectua în modul de lucru offline, care presupune aceleaşi operaţiuni pe calculator, calitatea de asigurat fiind de cele mai multe ori deja cunoscută sau putând fi verificată şi în alt mod. Sursa : news.ro recomandari pe a1.ro USR, despre verificarea contractelor cu fonduri europene ale firmei în care a fost partener Dan Barna: Acestea au mai fost verificate de organismele intermediare şi de autorităţile de management care nu au găsit niciun fel de nereguli financiare Orban, după consultările cu UDMR: Sunt [MASK] în privinţa deciziei UDMR Kelemen Hunor: UDMR nu a promis sprijin Guvernului PNL. Nivelul de încredere între cele două partide este scăzut. Voi discuta cu grupurile parlamentare săptămâna viitoare recomandari pe stirile antena 1 observator Un român a filmat momentul în care un alt român este fugărit şi prins de poliţişti, în Anglia (Video) Un şofer român de TIR l-a pus p...",['optimist'],[MASK] optimist
fulg_sha1:O7NJUXN,"Bine, nu culoarea în sine, cât faptul că pe ea petele de sânge sunt atât de vizibile. Poate pentru un adult este ceva normal, dar în mintea unui copil ele capătă un alt sens. Aveam 6 sau 7 ani când a trebuit să mă operez de polipi, eram foarte [MASK] deoarece doctora care urma să mă opereze avea o mică pată de sânge pe mânecă. Ea nu cred că o observase, dar ochii mei de copil speriat o remarcaseră aproape imediat. Îmi amintesc și acum că părinții mei optaseră pentru anestezie totală, nu mai știu dacă din cauza operației sau din cauza faptului că eram un copil.",['speriată'],[MASK] speriată
fulg_sha1:62MKTFA,"Scris de Victor 21 August 2009 5989390-lgMantuitorul meu, Astazi m-am gandit sa-ti scriu din nou... de la ultima scrisoare pe care Ti-am trimis-o s-au intamplat multe, multe lucruri pe care vreau sa le uit si sa o iau de la capat pe calea cea stramta catre Tine. Sunt [MASK], Doamne, simt ca uneori ma prabusesc, nu pot face fata navalirii pacatelor asupra mea, ma simt infrant si cad. Traiesc intr-o lume mare, traiesc langa fapturile pe care Tu le-ai zidit, dar, Doamne? De ce se schimba omul?",['istovit'],[MASK] istovit
fulg_sha1:WH6NF4K,"Vă îndemn pe toţi să protejăm şi să respectăm mediul înconjurător"", a spus preşedintele şi i-a amintit alpinistului că 'tinerele generaţii au nevoie de puterea exemplului'. Mesaj de la Iohannis acum doi ani La rândul său, Colibăşanu şi-a amintit de mesajul primit de la Iohannis, în urmă cu doi ani. ""Am fost [MASK] acum doi ani când în tabăra de bază am primit un e-mail din partea domnului preşedinte. În acel e-mail eram felicitat pentru ascensiune şi echipa rusă din jurul meu a auzit când, fără să îmi dau seama, am spus 'Mi-a scris preşedintele'. Toţi au întrebat 'Cine, preşedintele Federaţiei de Alpinism?'.",['mişcat'],[MASK] mişcat
fulg_sha1:I26LNIQ,"Publicat de levi capatan la 21:37 Un comentariu: Linkuri de întoarcere către această postare luni, 24 mai 2010 pamant ingenunchiat ...cum pot sa numar stelele cand sunt [MASK] de frumusetea Creatiei si cad in genunchi, in praf?... dar de aici de jos vad Dragostea Ta cum ma ridici si ma pui pe stanca... sunt in mana Ta...",['coplesit'],[MASK] coplesit
fulg_sha1:FW37O4H,"Cu această ocazie, şeful statului şi-a exprimat dorinţa de a deschide un muzeu al comunismului. 1 COMENTARIU Tweet ""Am dorit să fac o vizită la arhivele CNSAS fiindcă aici se găsește documentarea pentru o parte foarte importantă din istoria noastră. Sunt foarte [MASK] că am fost așteptat de conducerea CNSAS, care mi-a prezentat foarte multe lucruri interesante, modul în care este construită și exploatată această arhivă, cât și problemele cu care se confruntă. Cu siguranță că multe dintre aceste probleme pot fi relativ ușor rezolvate. Am înțeles că și aici avem de-a face cu o problemă de fonduri și cred că aceasta este una dintre problemele care se pot rezolva relativ ușor, pentru a permite modernizarea arhivei și eficientizarea muncii atât a oamenilor care se ocupă în mod curent de arhivă, cât și a cercetătorilor care vin să studieze anumite spețe.",['bucuros'],[MASK] bucuros
fulg_sha1:WJTH3UT,"ei fratilor are omul asta un stil la scris ca daca umorul ar fi o apa ati vedea inaintea voastra o cascada in timp ce cititi cartile astea doua. va spun pe onoarea mea, fara sa folosesc cuvinte mari ca atunci cand sunteti intr-o pasa proasta ori in alte situatii, cartile astea sunt curat medicament. am ras de nu mai puteam si sunt convins ca o sa le recitesc de cate ori o sa simt nevoia de ceva vesel in viata mea,atunci cand poate o sa fiu [MASK] sau suparat si-mi va trece toata starea pentru ca mi-ar fi imposibil sa fiu serios si daca citesc doar o pagina din cartile astea. eu cum spuneam am avut sansa sa-l cunosc si sa fim prieteni. daca intradevar vreti sa aveti o carte buna in biblioteca sa va deconecteze, cautati cartile astea si nu o sa va para rau ca ati dat banii pe ele.",['abatut'],[MASK] abatut
fulg_sha1:7QN4S43,"A inceput sa sape şi a găsit câteva monede. Ea a spus: ""M-am gândit ca trebuie să fie o comoara. Am fost foarte [MASK]. Cred ca mi se putea auzi inima cum bate ,de la o jumătate de milă distanţă. Toata lumea viseaza la o astfel de descoperire.",['emoţionata'],[MASK] emoţionata
fulg_sha1:KQDFAXZ,"Parca nimeni nu voia sa iasa din bula mica a scritorilor romani. Ma bucur foarte mult ca ""Ultimul avanpost"" este o distopie! Sunt [MASK] dupa distopii si spre rusinea mea, chiar daca auzisem de aceasta carte, nu am avut curajul sa o citesc. Dar sper ca in viitor sa pun mana pe ea. De asemeni imi plac raspunsurile Laviniei si printre raduri se vede ca este o fata minunata.",['innebunita'],[MASK] innebunita
fulg_sha1:MIR2KAR,"Erau oamenii care contau enorm pentru mine şi, din fericire, am avut acest suport care poate că a fost cel m-a ţinut, într-un fel, la suprafaţă"", a declarat Andronescu, plângând, la RTV. Aceasta a precizat că modul în care se prezintă lucrurile este incorect, deoarece nu a fost ministru în perioada în care au fost cumpărate licenţele. ""Sunt [MASK] pentru modul în care, dacă aşa se prezintă, acesta este absolut incorect. Din start, vreau să vă spun, în referatul prin care mi s-a ridicat imunitatea parlamentară, pentru că fusesem ministru în perioada aceea, scria un lucru care pe mine m-a şocat: că am fost ministru între 2008 şi 2012. Ori eu am fost ministru nouă luni, în Guvernul cu PDL, 2008-2009, până în 30 septembrie, şi în 2012 – şase luni.",['revoltată'],[MASK] revoltată
filmot_YrQiRn36Xx0_8552.9,tare am înghețat am stat în grădină înainte să vin spre trecută eu într un fel cred că am comunicat faptul că nu sunt [MASK] și că doar voiam doar din chestiile astea adică cu supărarea pe momente trecuse pentru că făceam în momentul ăla griji că.,['supărat'],[MASK] supărat
fulg_sha1:IHPFYKL,"Sunt două luptătoare pentru dreptate. Maria Macasin Trebuie de înțeles că nu trebuie de lăsat tot greul pe umerii firavi a femeilor cred că avem destul de mulți bravo bărbați ai neamului că sa susține masiv acestea doamne minunate Teodor Doros Sperăm la o colaborare fructuoasă în numele Neamului, în fruntea căruia vedem pe una dintre aceste Doamne! Ele sunt [MASK] cea mai mare pentru Hoți, cât de straniu n-ar părea! La dubă toți Hoții, care ne fac de rușine Neamul românesc! PAS a obținut în urma alegerilor 63 de mandate, BECS -32 și alte 6 au mers la ȘOR ""Pornim vremurile bune în Moldova!",['Frica'],[MASK] Frica
fulg_sha1:B56UOXV,"""Şi drumul cel mai lung începe tot cu un pas"" Cocktail de gânduri 10/18/2010 12:28:00 PM Toamna e problematica atunci când vine vorba de sentimente şi gânduri. Cel puţin azi a fost un pic de haos la mine. Am fost cam [MASK], anti-socială (cu toate ca ce urmeaza sa va povestesc o sa demonstreze contrariul) si iar am dat atenţie cuplurilor. Nu vorbesc neapărat despre cuplurile el-ea, mă refer şi la grupurile de prieteni. Ştiu că anul ăsta o să fie şi mai singuratic decât până acum pentru că aveam o singură prietenă cu care mă înţelegeam la facultate şi ea de anul ăsta nu mai vine.",['morocănoasă'],[MASK] morocănoasă
fulg_sha1:FCYJV3B,"Finalul sezonului 2014 a adus alte premiere in palmaresul romancei, calificarea la Turneul Campioanelor si victoria impotriva ""reginei"" tenisului femin, americanca Serena Williams, obtinuta cu un scor categoric, 6-0, 6-2, in cadrul acestei competitii. ""Este cel mai mare meci din viata mea. Nu pot sa explic acum ce simt, sunt foarte [MASK]. Vreau doar sa ma bucur. A fost visul meu sa inving pe una dintre surorile Williams"", a spus Halep atunci.",['fericita'],[MASK] fericita
fulg_sha1:V2WY6H4,"Vreau să adaug ceva, se încheie discuţia. Dacă am ceva de întrebat trebuie să vorbesc scurt şi la obiect. Iniţial m-am simţit [MASK]. Mi-am zis că o fi ceva în neregulă cu mine. Apoi m-am îmbărbătat singură.",['rău'],[MASK] rău
fulg_sha1:EF6P6AW,"...unei păduri. Tânărul își anunțase moartea pe Facebook! ""Sfarsit de viața pentru mine, m-am saturat de jigniri, injuraturi si bataie de joc, sunt [MASK] cat traiesc si o sa fiu bun când nu… 1 23456789101112131415161718192021222324252627282930313233343536373839404142434445464748495051525354555657585960616263646566676869707172737475767778798081828384858687888990919293949596979899100101102103104105106107108109110111112113114115116117118119120121122123124125126127128129130131132133134135136137138139140141142143144145146147148149150151152153154155156157158159160161162163164165166167168169170171172173174175176177178179180181182183184185186187188189190191192193194195196197198199200201202203204205206207208209210211212213214215216217218219220221 …222223224225226… 232 ULTIMELE ARTICOLE Ana Birchall o desființează pe Clotilde Armand 28/07/2021 Vasile Astărăstoae: ""SARS-CoV-2 – Un paradox"" 28/07/2021 100 de oameni au protestat pentru Flămâzi! 28/07/2021 Accident cu trei morți la Bacău 28/07/2021 ...",['rau'],[MASK] rau
fulg_sha1:N7AOMV3,"Nu poate omul să facă o confesiune că îl şi judecaţi. Te-am mângâiat pe păr uşor, Peruca ţi s-a dat pe spate Şi-înfocat Chelie am sărutat, Poate să-mi cadă-n cap şi o cărămidă! Sunt [MASK] că m-am îndrăgostit! Ai coborât din troleibuz, Mi te-ai arătat întreagă, Şchiopătai, Picior de lemn aveai, Poate că liricul are de suferit un pic, dar refuz să cred că aţi pierdut simţul umorului. Păi nu e azi 14 ?",['fericit'],[MASK] fericit
filmot_ryy-wtBEMoE_5061.1,Mă refer că a trecut perioada. Acuma sunt [MASK]. Tu zici vreau să fiu atită și noi avem o cea de trei ani. Păi mă simt un pic presată. Nuț ai făcut mai multăț acum. Acum i am făcut ei și după nu vine natural. Nu mai zic că vrei.,['șocată'],[MASK] șocată
fulg_sha1:DTF276H,"""Am avut patru meciuri, cu luptători din Congo, Senegal, Camerun și Franța. Mi-a fost cam rău în timpul concursului, am avut febră, a fost destul de greu pentru mine în timpul meciurilor. Dar, până la urmă am izbândit și sunt foarte [MASK] că mi-am atins obiectivul. Mi-a plăcut atmosfera din sală, am avut o supergalerie"", a declarat Vlad Caraș, în exclusivitate pentru caon.ro și Jurnal de Caraș-Severin. ""Vlad Caraş, medaliat cu aur la Jocurile Francofoniei, legitimat la clubul CSM Reșița, antrenat de maestrul emerit Adrian Dacica.",['fericit'],[MASK] fericit
red_v2_5922,Bune momentele când mă-ntâlnesc cu mine și sunt [MASK],['binedispus'],[MASK] binedispus
