id,input,labels,t5_trg
fulg_sha1:OSZWCVY,"... Altul, diplomat de viţă şi de-o-nţelepciune rară Era ""Logofăt de cinste-al trebilor de dinafară""; Altul, gospodar halal, Era şi el ""Logofătul trebilor din caşcaval""; Unul arţăgos din fire, cu de la-Împărat firman, Era ""Marele Hatman""; Altul, cu-ale sale gheare şi cu bietele-i măsele, Trebuia, prin caş, să facă numai drumuri şi şosele; Un alt şobolan ce-n viaţa-i n-a ştiut să fie hoţ, Destinat a fost să fie ""Logofăt peste negoţ""; În sfărşit, ale lor ranguri ca să nu le mai aştern, Erau tot ce se cuprinde azi la noi într-un ""Guvern""; Însă ce deosebire, Dumnezeule din Cer, De la ce-aveau şobolanii la al nostru ""Minister""!… Căci, pe când la noi ""Guvernul"", în iubirea lui de Ţară, Duce viaţa cea mai tristă, mai săracă, mai amară, Şi munceşte zi şi noapte, în osârdii de nespus, Dorind: Ţara să-şi ridice cât mai sus, Şobolanii din poveste, graşi din frunte până-n coadă, Jefuindu-şi şorecimea umilită şi neroadă, Alta nu face pe lume, decât caşul să li-l roadă!… Dar, de necrezut, şi, astfel, lucru de mirare foarte, Şobolanii mâncau caşul cu duşmanii lor de moarte, Adică, să ştiţi şi voi: Cu nenumăraţi cotoi!… Însă când trăiau mai bine, unşi pe bot ca şi pe coame, Iar mărunta şorecime, se stingea-ndurând de foame, Toţi cotoii, dintr-odată, Ca nişte grozavi duşmani, Au fost prins de beregată Pe-nfrăţiţii şobolani, Şi, strângându-le grumazul ne mai pomenit de crunt, Dregătorii toţi murit-au, până la cel mai mărunt, Şi-au rămas stăpâni cotoii pe tot caşul plin de unt!… … Fabula cu şobolanii, de cotoi traşi prin măsele, Am făcut-o, s-o citească şobolanii ţării mele, Şi, citind-o pe-ndelete, să nu-mi poarte mie [MASK], Ci să tragă, fiecare, următoarea-nvăţătură: Dregător al şorecimii, când mi te ridică valul, Tu n-ai dreptul, şobolane, să-i mănânci tot ""caşcavalul"", Iar frăţia cotoiască, chiar când pare dulce foarte, Şorecimii nu-i vrea bine, ci-i doreşte numai moarte!… Pentru ca se vorbeste, dupa aceasta campanie electorala atat de agitata, care a impartit tara in doua, din ce in ce mai des de reconciliere (eu una nu prea vad cum se poate realiza aceasta dorinta in viitorul apropiat, dat fiind rezultatul alegerilor si numele premierului desemnat) cred ca e de actualitate si fabula urmatoare: Ploaia si soarele La 'nceput, cand plugul inca nu ara ogoarele, - Pentr'un bob de linte fiarta, S'au luat, ma rog, la cearta Ploaia si cu Soarele… Fiecare, slab la minte, Sta, puterea sa'si masoare Si, -pazeste Doamne sfinte, - Pentr'un bob micut de linte, Cautau sa se omoare: Soarele, cu ochii 'n flacari, dupa ploae prin tot locul; Ploaia, cu potop de ape, cautand sa'i stinga focul… Am uitat sa spun ca bobul cel de linte cu pricina, Pe care'l facuse Sfantul Pan'a nu fi fost Lumina, - Nu era decat Pamantul… Astfel, Imparatul Ploae, avand tunete 'n cuvant Si-Imparatul Soare, -mandru si cu aur pe vestmant,- Fiecare sta sa spuna ca 'n puterea lui mareata, Tot pamantul o sa fie plin de Floare si de Viata… Dupa lupte fara seaman, ce le-ar micsora, cuvantul, Soarele-a ramas puternic Imparat pe tot pamantul Si-a 'nceput atunci, pe loc, Cu iubire sa'I trimita toata para lui de foc Insa, vai, in scurta vreme, ars de jar, secat de ape, A 'nceput intreg pamatul pretutindenea sa crape Si, ne mai putand sa 'ndure atat foc si-atata sete, In grozav de grele chinuri, sufletul curand isi dete Ploaia, care-atat dorise si era mereu pe-aproape Rasturnand pe mandrul Soare si pamantul vrand sa scape, A dat drumul, intr'o clipa stavilarelor de ape Si vre-o patruzeci de zile potopindu-l, fara voe, - Cand din toata omenirea a scapat doar Tata Noe, - Noul Imparat, in fine, pricepu 'necandu-l plansul, Ca pamantul iar murise, innecat ffind sub dansul Dumnezeu atunci le zise: Adevar imi e cuvantul, Ca 'n asemeni desbinare, nu veti ferici pamantul Deci uniti-va ca fratii… nu va mai priviti cu ura Si pamantului, de-a pururi dati-i apa si caldura, Totdeauna mana 'n mana, intelept si cu masura Ascultand porunca data, Ploaia si cu Soarele Se 'nfratira 'ntr'o clipita, astfel cum a zis Prea-Sfantul Si, punand la foc si apa, amandoi, zavoarele, S'a trezit din nou la viata, subt iubirea lor, pamantul: Inverzira pretutindeni, luncile, ogoarele Si, radea sub sfantul Soare Pururi, floare langa floare, - Fiecare mai vioaie, Cu potop de curcubee 'n picaturile de ploaie Incheind aci povestea, -cu-o iluzie amara, Dela cele talcuite, trec la biata noastra tara: Voi, alesii ei, cu minte, - de la cei doi imparati Luand pilda, - pe vecie prindeti-va astazi fratii Si, cu larga 'ntelepciune si iubire-adevarata, - Daca 'n aste doua haruri poate inima sa bata, - Dati Lumina si caldura pururi bietului pamant, In al carui san, strabunii si vitejii nostri sant, - Pentru ca, din harul vostru, sa rasara Soarele, Sa'i presare flori, pe toate luncile, ogoarele, Sa privim, cu plansu 'n gene, Pe valcele si poene, Iar in lacramile noastre, fericite, - nu de dor- Curcubeu, sa urce 'n slava mandrul tarii Tricolor Si pt ca atunci cand nu reusesc sa accesez situl dorit direct din comentariu recurg la Google pt ajutor de data asta motorul de cautare mi-a daruit un blog interesant, care aduna de pe web tot felul de poezele care ilustreaza starea natiunii, ca sa zic asa. ...",['ură'],[MASK] ură
fulg_sha1:WKBNXLL,"...(puteti alege 3 motive!) Prin razboi nuclear Datorita schimbarii climei Revolutie Mondiala Ziua Judecatii Invazia extraterestrilor Ciocnire cu un meteorit Molima de nestapanit Nu va avea loc nici o apocalipsa Din motive necunoscute Rezultate Loading ... Ecouri Recente Wanda Lucaciu în Teşu Solomovici sau arta falsificării şi a compilaţiei istorice (+78) Alexandru Leibovici în Vorba aceea din Târgu' Cucului… (+94) Alexandru Leibovici în De unde vine minciuna ""Teohari Georgescu = Burăh Tescovici"" (+6) CHARLIE în Ucraina – evenimentele curente (5 august – 12 august 2015) (+2) Petru Clej în ""Cincizeci de mii de români în Marea Britanie"" (+1) Petru Clej în Nu poți face din rahat bici și să mai facă și trosc – Republica Moldova, două decenii de independență (+33) Victor Manta în Informaţii noi despre masacrele antisemite din 1940 (+35) Petru Clej în A venit vremea ca România să dezincrimineze negarea Holocaustului (+176) Alexandru Leibovici în Între Regele Mihai și Ion Antonescu îl aleg fără ezitare pe primul (+48) dr.r.neumann în Israel: Biblia şi legitimitatea (+77) Propuneti video Email Ediții Aprilie 2015 Martie 2015 Februarie 2015 Ianuarie 2015 Decembrie 2014 ... Cele mai comentate articole din ultima luna Teşu Solomovici sau arta falsificării şi a compilaţiei istorice 78 comments | by Rodica Grindea Informaţii noi despre masacrele antisemite din 1940 35 comments | by Adrian Cioflanca Imperiul nu mai are mult de trăit 31 comments | by Arkadii Babcenko Despre răscoala din 1907 așa cum n-ați învățat la școală 28 comments | by Lucian Zeev HERȘCOVICI Vorba aceea din Târgu' Cucului… 25 comments | by Rodica Grindea A venit vremea ca România să dezincrimineze negarea Holocaustului 13 comments | by Petru Clej Ce conţine acordul nuclear cu Iranul 8 comments | by Oana Serafim Israel: Biblia şi legitimitatea 6 comments | by Ramon Neumann Hiroşima şi iertarea (I) – republicare 5 comments | by Alexandru Leibovici De ce am [MASK] față de negaționism 4 comments | by Petru Clej ACUM este asociat cu: Omnitop • Radioamator.ro • RomanianJewish.org • La Pensie © ACUM 2003 - 2015 • Reproducerea tiparita permisa numai cu autorizare • Despre noi • Cum postam? ...",['repulsie'],[MASK] repulsie
fulg_sha1:LQUCP62,"Iar data viitoare, îi trimit un mesaj Mărioarei să ieşim la o plimbare cu rolele, în loc să ne ""sms"" până ne dor degetele. Probabil şi un banal mail cu ""ceau, ce faci? când ne vedem, că mi-e [MASK] de tine!"", (mi-)ar pica mai bine decât o discuţie de juma' de oră la telefon în care ne punem reciproc la curent cu noutăţile. PS: asta cred că derivă cumva şi din uimirea mea când lumea cere mii şi mii de minute, de parcă n-ar avea altceva de făcut. Ce naiba, toţi facem bijniţ, de vorbim atâta la telefon?",['dor'],[MASK] dor
fulg_sha1:PIS5CFL,"Ionel Danciulescu spunea in interviul acordat in exclusivitate la Radio Dinamo1948 ca isi doreste sa jucam cu Steaua in prima etapa din play off . Intilnim FCSB sau ASA in prima etapa din play off. Conform tintarului stabilit de catre cei de la LPF in prima etapa din play off se va disputa intre echipele ce se vor clasa pe urmatoarele pozitii: Sunt [MASK] pentru ca am trecut cu bine acest test ""Sunt mulțumit, am trecut cu bine acest test. Dacă ținem cont că am jucat în 10 din prima repriză, după care a apărut și accidentarea lui Ekeng, în repriza a doua, când practic am rămas în 9, atunci e bine. Acum sunt la Dinamo şi muncesc pentru Dinamo.",['multumit'],[MASK] multumit
fulg_sha1:I5KJZJ4,"Dar pe viitor nu ma pronunt...s-ar putea:) corina Uneori ochiul omului este prins de mirajul lumii si pierde contactul cu divinul... O zi binecuvantata Cori draga! maranata Ma bucura mult trecerea ta pe aici.Ma simt [MASK].Maranata! Lisandru Cristian Sa ramana si peste sufletele voastre ""ochiul LUI"" ASTA VA DORESC AZI SI MEREU. Imbratisari cu sufletul dragii mei dragi!",['incurajata'],[MASK] incurajata
filmot_3F3-BlIhhmQ_4131.9,până în ultima clipă dar poate când până când punem ovăzul domnul doctor ar fi aflat și am greu păstrând e bine văd sunt [MASK] că poate. Oamenii aceștia ar fi suferit mai multe gând induse că poate putem să facem acele câteva luni un an. Dumnezeu.,['bucuros'],[MASK] bucuros
fulg_sha1:KO3BF45,"Aveai dreptate. Ştiai că îmi e teamă de emoţiile dinăuntrul meu. Fără vreo mască după care să mă ascund, vreun rol pe care-l să-l joc, mi-e [MASK] de mine însămi. De când ai plecat, nimeni nu mai intră. Nimic nu mai iese.",['groază'],[MASK] groază
fulg_sha1:VNAM2LO,"...VA de 100 mil E. Toate aceste GRESELI, cumulate cu numarul mic de contribuabili la bugetul de stat, au condus la solutia IPOCRITA a guvernului Roman sa adopte Taierea tuturor drepturilor la orice nivel in randul BUGETARILOR cu 25 %. Asta si nu numai asta ma face pe mine si Nu numai sa am [MASK] fata de asa zisi REVOLUTIONARI, voua Nu va taiat nici un sfant, Nu ma deranjeaza in mod special acest fapt cat, MA DERANJAZA, faptul ca in randul celor ce beneficiaza de aceste drepturi SUNT IMPOSTORI, oameni ce nu au avut nici- n calci nici in maneca cu Revolutia, ba din cate am auzit sunt Revolutionari nascuti in 1990, 1991, 1992 chiar si Nu sunt din cei ce sunt URMAS si chiar si asa, cum poate fi urmas al unui Revolutionar Martir, un copil nascut in 1991??? pai sa F… in 1989 toamna si la tinut in burta inca un an, la decolorare sau la ce????? Aicia e o ADEVARATA problema zic eu in randul dumneavoastra, fapt pentru care exista si atata URA si Interese DIFERITE de la o asociatie la alta ...",['REPULSIE'],[MASK] REPULSIE
filmot_Hq71oae-20k_1852.3,"Păi asta de obicei așa spune se spunea pe atunci să trebuia să fii înainte să fii. Deci taică meu era siderat. Aveam o relație cu un tip care mare, nu știam ce învârte, eram [MASK] mare a fost. Și mă întâlnesc cu el acolo.",['dragoste'],[MASK] dragoste
fulg_sha1:7BSLP64,...ii There are currently 24 comentarii on Secretara perfectă – episoadele 1 şi 2. Perhaps you would like to add one of your own? 1 dana ivancea 09/06/2012 la 12:12 pm foarte interesanta actiunea personajelor colaterale ale acestui serial……abia astept sa le vad(daca am timp!!!!)este o problema pentru mine timpul asta!!!!!ah…ah….ah) aceste doua episoade sunt inceputul erei ilarice!!!ce bine!…….multumim pentru rezumate Anca P…..dar mai exact la ce ora le difuzeaza euforia?…ca asta chia nu mai stiu….sunt asa de [MASK]…….ca am si eu ceva treaba pe aici si nu prea mai sunt la curent cu orele de difuzare …si cu ce seriale noi urmeaza sa inceapa……dar oricum imi place ce ai scris…am inteles ca este comedie?….hahahaahhahahh….da!da!da!…….sa mai si radem…… Răspunde 1.1 Maria 09/06/2012 la 12:23 pm Din pacate Eufori difuzeaza acest serial la 17:30 in timpul lui The Duo. Eu ieri m-am uitat fiinca cei de la TVR 1 nu au dat filmul.E un fil foarte haios. 2 Maria 09/06/2012 la 12:19 pm Ce ma bucur c...,['ametita'],[MASK] ametita
fulg_sha1:47KICH2,"Francezii și italienii rămân « dans le haut du panier », (precum le place chiar lor să creadă despre ei, în general. Mai ales celor dintâi) dacă ar fi să facem generalizări, care nu-s niciodată chiar bune. Dar dacă tot facem generalizări, tare mi-e [MASK] că noi suntem încă tributari limbii de lemn. Nu că n-ar fi limbă de lemn și la nivel european, dar a noastră parcă-i mai… fibroasă și țeapănă. Citim ca pe apă niște discursuri scrise, ne plac frazele lungi, așa de lungi că se îneacă și peștele la un moment dat în ele… Da, mi se pare că la nivelul artei oratoriei românii mai au mult de lucrat.",['teamă'],[MASK] teamă
fulg_sha1:OZRTQTW,"Evident că n-a făcut nimic. Şi mă durea în ultimul hal. Eram [MASK]. După miere, găsesc altă şmecherie. Cică să pui ulei cald în ureche, puţin ulei, că trece toată durerea de maxilar.",['turbată'],[MASK] turbată
fulg_sha1:J64EQAZ,"Nu e nimic serios, insa e sacaitor. Am aproape doua saptamani sa ma recuperez pana la Wimbledon, asa ca ma voi odihni cateva zile, apoi voi face tratament si voi incepe sa joc din nou. Sunt [MASK], era primul meu turneu pe iarba in acest an. Era important sa am niste meciuri, dar nu pot sa mai schimb nimic acum. Trebuie sa am grija de corpul meu.",['dezamagita'],[MASK] dezamagita
fulg_sha1:UTINUK5,"Această zi este marcată, din 1999, în tot mai multe orașe de pe continentul european, fiind o inițiativă a Comisiei Europene, susținută de Uniunea Europeană. În ultimii ani, a câ� ... Primul mesaj al ambasadorului SUA: Sunt [MASK] de cultura şi istoria României! Noul ambasador al SUA la Bucureşti, Hans Klemm, se prezintă azi într-un mesaj pe Facebook adresat în limba română, în care spune că este fermecat de cultura, limba şi istoria României şi că ţelul său este să consolideze parteneriatul de securitate şi să sprijine lupta împotriva corupţiei, notează agenți ... Iată cum arată tabăra de refugiaţi construită de România la graniţa cu Serbia Primele 50 de corturi din tabăra de refugiaţi aflată la 300 de metri de graniţa cu Serbia, în satul Lunga, care aparţine comunei timişene Comloşu Mare, au fost ridicate duminică, aceastea având posibilitatea, la final, să adăpostească circa 500 de migranţi, iar la Moraviţa se ridică a doua tabără.",['fermecat'],[MASK] fermecat
fulg_sha1:SHEUCPX,"Dubla lui Lampard si golurile lui Malouda si Kalou au pregatit terenul pentru meciul cu CFR din Champions League. ""Cupa Carling este foarte importanta pentru noi, altfel nu mi-as fi trimis cea mai buna echipa pe teren. Sunt [MASK] pentru ca am debutat in trei competitii cu trei victorii"", a declarat antrenorul Scolari dupa fluierul de final. Primul gol a fost inscris de Frank Lampard din penalty, dupa ce Ballack a fost faulat in careu de fundasul Nadir Belhadj. Boss-ul lui Portsmouth, Harry Redknapp l-a acuzat pe german ca a simulat faultul: ""Acela nu a fost penalty.",['incantat'],[MASK] incantat
fulg_sha1:VDDDYUZ,"La testul nostru de playback video am atins 11 ore şi 56 de minute, deci Netflixerii pot jubila. Am depăşit HTC U11 şi iPhone X, dar şi iPhone 8, rămânând sub Galaxy S8 totuşi şi iPhone 7, dar nu cu mult. În PCMark am fost [MASK] de cât de bun a fost rezultatul, atingând 11 ore şi 1 minut, ceea ce plasează telefonul pe locul 18 all time. E un rezultat excelent şi peste Galaxy S8, Xperia XA1 Ultra şi Samsung Galaxy A8 (2018). Test - Video playback 1.iHunt Titan P11000 Pro27h 50m 2.Allview P8 Energy22h 24m + 93.Sony Xperia XZ1 Compact11h 56m 94.Xiaomi Mi A2 Lite11h 55m 95.Motorola Moto G5S Plus11h 54m 96.ZTE Nubia N111h 53m 97.Motorola One Action11h 49m 98.Samsung Galaxy A20e11h 48m 99.Apple iPhone X11h 47m 100.Xiaomi Redmi Note 3 Pro11h 45m 101.Motorola One11h ...",['şocat'],[MASK] şocat
fulg_sha1:QCFUJXS,"Eu am mai fost în Asia acum ceva timp, dar am zis să schimbăm un pic, să luăm așa continentele, pe rând. Măcar în ianuarie să prind puțin bronz. Sunt foarte [MASK] în timpul călătoriei, dorm tun pe avion, nu am nicio problemă"", a declarat, pentru Libertatea, Alina Eremia Nu are gânduri de măritiș Artista trăiește o frumoasă poveste de dragoste alături de Edi, însă pe inelarul ei nu a apărut un inel cu vreo semnificație de logodnă, iar căsătoria nu se află momentan, se pare, printre priorități. Cel puțin asta ne-a mărturisit Alina Eremia. Rămâne de văzut dacă artista îți va schimba convingerea în acest an.",['relaxată'],[MASK] relaxată
fulg_sha1:RHV6SDL,"Nu voi mai da puterea mea celor care încearcă să mă controleze și să mă manipuleze. Eu dețin propria putere și îmi asum responsabilitatea pentru alegerile și deciziile pe care le fac în fiecare zi. Îmi iau angajamentul să spun ""nu"" când îmi este cerut să fac ceva ce nu vreau să fac și refuz să mă simt [MASK]. Mă respect.Nimeni nu ma poate controla mental, emotional, sexual, daca eu nu permit acest lucru.Sunt libera. Nu există limite la ceea ce pot realiza în viața mea.",['vinovata'],[MASK] vinovata
fulg_sha1:HONRCHD,"Nu acelaşi lucru îl poate spune cântăreaţa cu barbă de la Eurovision! Author adminx Post navigation Previous Previous post: Ce a spus Simona Halep la revenirea în România Next Next post: În PNL au început luptele în teritoriu pentru atragerea electorilor la Congresul care va fi fundamental pentru liberalii români! Related Posts Categories EditorialPosted on decembrie 13, 2013 mai 7, 2020 Pedofilia politică Sunt [MASK] până la vomă când văd ce fac o parte din politicieni înainte de Crăciun. Pentru că cineva le-a spus asta, sau poate din convingere, aceștia se transformă în niște Moș Crăciuni sau Crăciunițe de prost gust și aleargă cu sufletul la gură spre cele câteva căm... Categories EditorialPosted on mai 21, 2014 mai 7, 2020 Romeo de la Cotroceni și Julieta cu parașuta La Cotroceni, celebra scenă a balconului din ""Romeo şi Julieta"" a căpătat noi conexiuni, filonul său epic fiind schimbat din temelii.",['îngrețoșat'],[MASK] îngrețoșat
fulg_sha1:VMVDDDK,"Încă un subiect tabu, deși cabinetele estetice sunt pline de femei care apelază la rejuvenare vaginală și/sau labioplastie. Nu am înțeles de ce, într-o epocă în care lumea pare că este total lipsită de inhibiții și perfect asumată cu noul secol al tehnologiei, când suntem la un singur click de tot și toate, nouă încă ne este rușine să abordăm cu seriozitate subiecte precum : menopauza, educația sexuală, rejuvenare vaginală…etc. M-am gândit că poate printre… 7 zile în Spania Întotdeauna am fost [MASK] de liniștea pe care o au spaniolii, italienii și grecii. Probabil că mai sunt și alte popoare așa, dar eu încă nu le-am găsit. În Grecia merg an de an, doar că în locuri diferite, în Italia fusesem acum 2 ani, chiar înainte de Pandemie, așa că era cazul să revin în frumoasa Spanie.",['fascinată'],[MASK] fascinată
fulg_sha1:BGYBVF3,"Şi te poţi încrede traduceri autorizate în mine fără nici o retinere. Voi face tot ce-mi stă în putintă. mi-e foarte [MASK] că... e prea tîrziu. Spune-mi, şi încuietoarea de la valiză a fost forţată ?",['teamă'],[MASK] teamă
fulg_sha1:PCXG5L3,"Nivelul de nicotină a fost colectat din fumul fiecărei țigări – fumul fiind scos de o mașinărie specială care simulează fumatul. Diferența este una evidentă: nicotina din trabuc ajunge la nivelul de 1,24 miligrame față de 0,87 miligrame la o țigareță. ""Am fost [MASK] să văd că acesta este nivelul de nicotină din trabucuri. Un sortiment chiar mi-a atras atenția, cel cu aromă de cuișoare. Are și cel mai mare nivel de nicotină și nu e de mirare că au pus aroma de cuișoare.",['uimită'],[MASK] uimită
fulg_sha1:CQU5FFY,"skip to main | skip to sidebar Multe şi mărunte poveste cu personaje mai mult sau mai puţin imaginare, conţinut mai mult sau mai puţin ambiguu şi sfârşit în totalitate nedefinit ""The bitterest tears shed over graves are for words left unsaid and deeds left undone."" Harriet Beecher Stowe miercuri, 30 aprilie 2014 Imagini din mileniul trecut (2) Târgu Mureş - Piaţa Trandafirilor Târgu Mureş - din colecţia de fotografii şi cărţi poştale ilustrate vechi a vecinei Adela, pentru miercurea fără cuvinte Reacții: Trimiteți prin e-mail Postați pe blog!Distribuiți pe TwitterDistribuiți pe FacebookTrimiteți către Pinterest Etichete: amintiri, coana Adela, miercurea fără cuvinte, mileniul trecut 10 comentarii: Maria 30 aprilie 2014, 16:39 stii ca dupa toate discutiile despre autonomie si minoritati, sunt putin [MASK] cand merg in partea aceea de tara? RăspundețiȘtergere Răspunsuri Mariana 30 aprilie 2014, 17:13 Te cred. ...",['intimidata'],[MASK] intimidata
fulg_sha1:QOGSZWM,"Şi linia vieţii de la electrocardiograf neîntreruptă, țiuind monoton, mirosind reavăn a moarte. Copilul ăsta te-a aşteptat să-l creştinezi, mi-a zis Ilinca. Eram atât de [MASK] încât n-am mai zis nimic. Dar în minte mi se pecetluise pentru veşnicie zâmbetul acela dumnezeiesc."", a povestit el. Postarea preotului a devenit virală și mulți s-au arătat emoționați până la lacrimi de cele întâmplate.",['zdrobit'],[MASK] zdrobit
fulg_sha1:6IP5REJ,"} – Mar 05, 10:45 PM M. { Thank you for your kind words! } – Feb 26, 12:24 AM Arhivă Select Month February 2014 (1) January 2014 (2) December 2013 (3) November 2013 (3) October 2013 (7) September 2013 (11) August 2013 (12) July 2013 (12) June 2013 (11) May 2013 (3) April 2013 (14) March 2013 (23) February 2013 (23) January 2013 (27) December 2012 (23) November 2012 (18) Despre mine Mă numesc Chiţu Costin-Ştefan, am 22 de ani, iar de cinci ani investesc într-o serie de instrumente financiare şi sunt [MASK] atât de branding, cât şi social media. Contact Mobil: 0741.160.110 E-mail: chitucostinstefan@gmail.com Oraș: București. Postări Recente Google+, o unealtă de marketing online folosită prea rar Beneficiile cunostințelor de design în mediul online The Wolf of Wall Street – Review © Chiţu Ştefan 2013 Socializează cu mine pe pagina mea de Facebook.",['pasionat'],[MASK] pasionat
fulg_sha1:2RAY6KL,"februarie 28 09:49 2017 Printeaza articolul Distribuie prietenilor by Ramona Balteanu 0 Comentarii Administraţia locală din Ştefăneşti se poate lăuda cu asfaltarea tuturor drumurilor comunale, investiţii care s-au realizat pe perioadă a două mandate. Mai mult, primarul Alexandru Uţă spune că şi drumurile de tarla din localitate se vor moderniza în următoarea perioadă. Un alt proiect important pentru comunitate va fi reabilitarea Şcolii ""Teodor Bălăşel"", un obiectiv prioritar pentru acest mandat: ""Pot spune doar că, după două mandate sunt [MASK], pentru că am realizat tot ce mi-am propus în procent de 90%. Dacă va continua asfaltarea drumului judeţean, proiect pe care îl avem în derulare, voi putea spune că Ştefăneştiul este localitatea integral asfaltată, în timpul mandatelor mele. Nici măcar un centimetru de drum nu mai rămâne neasfaltat, iar, pentru drumurile de tarla, am în derulare un proiect pe care îl vom depune la finanţare cu fonduri europene, pe o lungime de 12,6 ki...",['mândru'],[MASK] mândru
fulg_sha1:AMX2GWT,"""lumea mea doar din poeme"" Pagini BLOG LUCRĂRI CĂLĂTORII PRESĂ CĂRŢI FILMULETELE MELE duminică, 27 ianuarie 2013 Stele pentru mine îmi picură stele albastre-n fereastră mi-e [MASK] de o iarnă de prima întâlnire a noastră de primul sărut, de prima privire de primul cuvânt, de ochii tăi senini plini de strălucire îmi cad de prin ceruri imagini de stele rotunde mi-e dor de atingeri, de vorbe mărunte mi-e dor de cuvinte doar pentru mine de-a ta căutare, mi-e dor chiar de tine iar picură stele la mine-n grădină sunt stele, sunt şoapte sau e doar lumină? sunt şoapte rostite din visele mele, sunt şoapte de rouă... cu stele albastre în suflet îmi plouă la ora 20:34 Reacții: Trimiteți prin e-mail Postați pe blog!Distribuiți pe TwitterDistribuiți pe FacebookTrimiteți către Pi...",['dor'],[MASK] dor
fulg_sha1:PQJST2R,"Acum după ce viață ei s-a aranjat și s-a obișnuit deja cu grijile și preocupările pe care le are pentru cei doi copii ai săi, Ana și Vlad, a început să se gândească serios la revenirea în televiziune. ""Anul asta fac 20 de ani de presă dintre care vreo 17 de televizune doar la Antena 1. Mi-e [MASK] de televiziune dar nu știu când se va întâmplă și în ce formulă. Nu mai am foarte multe de demonstrat. Am relaxarea asta tocmai pentru că am atâția ani de televiziune în spate.",['dor'],[MASK] dor
